"tweet_id","username","name","first_name","last_name","full_text","view_count","bookmark_count","favorite_count","reply_count","retweet_count","quote_count","bookmarked","favorited","retweeted","user_mentions","url_mentions","is_quote_status","lang","location","bio","website","websites","followers_count","following_count","media_count","statuses_count","favourites_count","listed_count","fast_followers_count","normal_followers_count","followed_by","following","can_dm","can_media_tag","profile_banner_url","profile_url","avatar_url","verified","is_blue_verified","user_created_at","created_at"
"1773317263921197507","thapagk","Gagan Thapa","Gagan","Thapa","*संवाद यात्रा*
संवाद यात्राको यो चरणमा आज दिनभर नवलपरासीका हुलाकी राजमार्ग आसपासका विभिन्न स्थानमा किसानसंग मल विउ र मुल्यको कुरा,शिक्षक विद्यार्थी अभिभावकसंग शिक्षाको गुणस्तरको कुरा,उद्योगी व्यवसायीसंग व्यवसायिक लगानी ऋण र व्यबस्थापनका कुरा,सिमाना भूमि र सुकुमबासीका… https://t.co/E1zcwk2sLG","18675",0,344,61,38,8,false,false,false,"","",false,"ne","Nepal","Member , House of Representatives (Kathmandu-4),  General Secretary, Nepali Congress. 🇳🇵","http://gaganthapa.com.np","http://gaganthapa.com.np",1292512,1248,1031,3738,6369,372,0,1292512,,,false,false,"https://pbs.twimg.com/profile_banners/93589182/1706327764","https://www.twitter.com/thapagk","https://pbs.twimg.com/profile_images/1752662263310213121/-7WSkFg2_normal.jpg",false,true,"11/30/2009, 2:07:10 PM","3/28/2024, 5:37:37 PM"
"1772909093369397334","thapagk","Gagan Thapa","Gagan","Thapa","अब हाम्रो भेट र भलाकुसारी संवाद यात्रामा!

हामीले माघ १३ गते मेची पुलबाट सुरु गरेको संवाद यात्रा माघ २२ गते नवलपरासीको गोपीगञ्ज सम्म आएर रोकिएको थियो। हाम्रो संवाद यात्राको शृङ्खला त्यहीँ ठाउँबाट पुनः सुरु हुदैछ। यो चरणको यात्राका क्रममा हामी यहीँ १५ ,१६ र १७ गते नवलपरासी,… https://t.co/505lD62CMr","55894",1,470,118,65,16,false,false,false,"","",false,"ne","Nepal","Member , House of Representatives (Kathmandu-4),  General Secretary, Nepali Congress. 🇳🇵","http://gaganthapa.com.np","http://gaganthapa.com.np",1292512,1248,1031,3738,6369,372,0,1292512,,,false,false,"https://pbs.twimg.com/profile_banners/93589182/1706327764","https://www.twitter.com/thapagk","https://pbs.twimg.com/profile_images/1752662263310213121/-7WSkFg2_normal.jpg",false,true,"11/30/2009, 2:07:10 PM","3/27/2024, 2:35:41 PM"
"1770434726437793873","thapagk","Gagan Thapa","Gagan","Thapa","थोरै व्यक्तिगत, पारिवारिक कुराकानी अनि थोरै सुरुवाती राजनितिक यात्रा, अबको बाटाे, नेतृत्व, नीति निर्माणका अफ्ट्याराहरु, देशमा युवा उद्यमी तथा उद्यमशीलताको सम्भावना र तत्त्काल सुल्झाउनु पर्ने विषय लगायतका सन्दर्भमा नरोत्तम दाईसँग केहि औपचारिक र केहि अनौपचारिक कुराकानी ।…","71274",9,485,168,48,9,false,false,false,"","",false,"ne","Nepal","Member , House of Representatives (Kathmandu-4),  General Secretary, Nepali Congress. 🇳🇵","http://gaganthapa.com.np","http://gaganthapa.com.np",1292512,1248,1031,3738,6369,372,0,1292512,,,false,false,"https://pbs.twimg.com/profile_banners/93589182/1706327764","https://www.twitter.com/thapagk","https://pbs.twimg.com/profile_images/1752662263310213121/-7WSkFg2_normal.jpg",false,true,"11/30/2009, 2:07:10 PM","3/20/2024, 6:43:26 PM"
"1769687645666299930","thapagk","Gagan Thapa","Gagan","Thapa","नक्कली भुटानी शरणार्थी प्रकरण, बाँसबारी छाला जुत्ता प्रकरण, टेरामेक्स, एनसेल, सुन काण्ड, सहकारी काण्ड आदिमा संलग्न भएको एकजनाले पनि उन्मुक्ति नपाओस्। नेता होस् कि नाता पर्ने होस्, रूखको छहारीमुनि बस्ने होस् कि घाम ताप्ने होस् कि हँसिया हतौडा बोक्ने होस् कि घन्टी बजाउने होस्, दोषी… https://t.co/QNRgKvQxor","129518",23,1057,318,218,95,false,false,false,"","",false,"ne","Nepal","Member , House of Representatives (Kathmandu-4),  General Secretary, Nepali Congress. 🇳🇵","http://gaganthapa.com.np","http://gaganthapa.com.np",1292512,1248,1031,3738,6369,372,0,1292512,,,false,false,"https://pbs.twimg.com/profile_banners/93589182/1706327764","https://www.twitter.com/thapagk","https://pbs.twimg.com/profile_images/1752662263310213121/-7WSkFg2_normal.jpg",false,true,"11/30/2009, 2:07:10 PM","3/18/2024, 5:14:48 PM"
"1769219348894249393","thapagk","Gagan Thapa","Gagan","Thapa","The Office of MP @MPOfficeKtm4  successfully conducted the second session of Skill Up on Effective Communication and Public Speaking. 

Skill Up is a monthly series where by we organize trainings to enhance skills essential for the job market. What would you want the next session… https://t.co/NyWmRDeGUp","11194",0,153,14,14,1,false,false,false,"MPOfficeKtm4","",false,"en","Nepal","Member , House of Representatives (Kathmandu-4),  General Secretary, Nepali Congress. 🇳🇵","http://gaganthapa.com.np","http://gaganthapa.com.np",1292512,1248,1031,3738,6369,372,0,1292512,,,false,false,"https://pbs.twimg.com/profile_banners/93589182/1706327764","https://www.twitter.com/thapagk","https://pbs.twimg.com/profile_images/1752662263310213121/-7WSkFg2_normal.jpg",false,true,"11/30/2009, 2:07:10 PM","3/17/2024, 10:13:57 AM"
"1767530066370535607","thapagk","Gagan Thapa","Gagan","Thapa","आजको दिनमा TripAdvisor मा 'Sherpa' रेष्टुरेन्ट पुरै Amsterdam शहर भरी २ नम्बरमा पर्छ। 
त्यसका एक सञ्चालक सालिक गौतम नेपाली काँग्रेसका महासमिति सदस्य मात्र होइनन्, गज्जबका उद्यमी पनि हुन। 
नेपालीहरूले जहाँ भए पनि गज्जब गर्न सक्छन् र काँग्रेस उद्यमीहरूको पार्टी हो भन्ने कुरा… https://t.co/66qsVkluPL","48059",2,455,192,36,15,false,false,false,"","",false,"ne","Nepal","Member , House of Representatives (Kathmandu-4),  General Secretary, Nepali Congress. 🇳🇵","http://gaganthapa.com.np","http://gaganthapa.com.np",1292512,1248,1031,3738,6369,372,0,1292512,,,false,false,"https://pbs.twimg.com/profile_banners/93589182/1706327764","https://www.twitter.com/thapagk","https://pbs.twimg.com/profile_images/1752662263310213121/-7WSkFg2_normal.jpg",false,true,"11/30/2009, 2:07:10 PM","3/12/2024, 6:21:21 PM"
"1765972068904903087","thapagk","Gagan Thapa","Gagan","Thapa","सुरक्षा,सहभागिता,समता र सम्मान!
अन्तर्राष्ट्रिय नारी दिवसका अवसरमा स्वदेश तथा विदेशमा रहनु भएका सम्पूर्ण महिला दिदी बहिनीहरूमा हार्दिक शुभकामना! https://t.co/342vo8DEm5","9362",1,217,11,15,0,false,false,false,"","",false,"ne","Nepal","Member , House of Representatives (Kathmandu-4),  General Secretary, Nepali Congress. 🇳🇵","http://gaganthapa.com.np","http://gaganthapa.com.np",1292512,1248,1031,3738,6369,372,0,1292512,,,false,false,"https://pbs.twimg.com/profile_banners/93589182/1706327764","https://www.twitter.com/thapagk","https://pbs.twimg.com/profile_images/1752662263310213121/-7WSkFg2_normal.jpg",false,true,"11/30/2009, 2:07:10 PM","3/8/2024, 11:10:26 AM"
"1765911572054986774","thapagk","Gagan Thapa","Gagan","Thapa","ॐ नमः शिवाय || महाशिवरात्रिको शुभकामना ! https://t.co/ooTxUlIaTZ","14570",3,429,132,72,6,false,false,false,"","",false,"hi","Nepal","Member , House of Representatives (Kathmandu-4),  General Secretary, Nepali Congress. 🇳🇵","http://gaganthapa.com.np","http://gaganthapa.com.np",1292512,1248,1031,3738,6369,372,0,1292512,,,false,false,"https://pbs.twimg.com/profile_banners/93589182/1706327764","https://www.twitter.com/thapagk","https://pbs.twimg.com/profile_images/1752662263310213121/-7WSkFg2_normal.jpg",false,true,"11/30/2009, 2:07:10 PM","3/8/2024, 7:10:02 AM"
"1765347659454255398","thapagk","Gagan Thapa","Gagan","Thapa","कुनै अलमलमा नपरौँ।धोका दिने नै नियत भएकाले,आज नभए भोलि धोका दिन्थे नै! त्यसैले अब कांग्रेसलाई Rebuild, Restart र Restrengthen गरौँ।
जय नेपाल ! https://t.co/BDz7xvJhgG","99317",27,1216,259,146,94,false,false,false,"","",false,"ne","Nepal","Member , House of Representatives (Kathmandu-4),  General Secretary, Nepali Congress. 🇳🇵","http://gaganthapa.com.np","http://gaganthapa.com.np",1292512,1248,1031,3738,6369,372,0,1292512,,,false,false,"https://pbs.twimg.com/profile_banners/93589182/1706327764","https://www.twitter.com/thapagk","https://pbs.twimg.com/profile_images/1752662263310213121/-7WSkFg2_normal.jpg",false,true,"11/30/2009, 2:07:10 PM","3/6/2024, 5:49:15 PM"
"1763779809589776803","thapagk","Gagan Thapa","Gagan","Thapa","रसुवाको गोसाइँकुण्ड दर्शन एवं लाङटाङ खोई हि क्षेत्र भ्रमण। https://t.co/KQZKKhGnMN","37910",1,554,55,11,7,false,false,false,"","",false,"ne","Nepal","Member , House of Representatives (Kathmandu-4),  General Secretary, Nepali Congress. 🇳🇵","http://gaganthapa.com.np","http://gaganthapa.com.np",1292512,1248,1031,3738,6369,372,0,1292512,,,false,false,"https://pbs.twimg.com/profile_banners/93589182/1706327764","https://www.twitter.com/thapagk","https://pbs.twimg.com/profile_images/1752662263310213121/-7WSkFg2_normal.jpg",false,true,"11/30/2009, 2:07:10 PM","3/2/2024, 9:59:10 AM"
"1762099773681565858","thapagk","Gagan Thapa","Gagan","Thapa","वरिष्ठ गायक तथा संगीतकार भजन शिरोमणि भक्तराज आचार्यप्रति हार्दिक श्रद्धाञ्जली! भौतिक रुपमा उहाँ हामीमाझ नरहेपनि उहाँका कालजयी गीत तथा भजन चिरकालसम्म गुञ्जिरहनेछन। उहाँको वैकुण्ठ बासको कामना सहित शोक सन्तप्त परिवार प्रति गहिरो समवेदना ! https://t.co/j5wV3GSrXm","18772",0,392,39,19,3,false,false,false,"","",false,"ne","Nepal","Member , House of Representatives (Kathmandu-4),  General Secretary, Nepali Congress. 🇳🇵","http://gaganthapa.com.np","http://gaganthapa.com.np",1292512,1248,1031,3738,6369,372,0,1292512,,,false,false,"https://pbs.twimg.com/profile_banners/93589182/1706327764","https://www.twitter.com/thapagk","https://pbs.twimg.com/profile_images/1752662263310213121/-7WSkFg2_normal.jpg",false,true,"11/30/2009, 2:07:10 PM","2/26/2024, 6:43:18 PM"
"1759403353153642711","thapagk","Gagan Thapa","Gagan","Thapa","प्रजातन्त्र दिवस २०८० को शुभकामना ! https://t.co/hvZEFuuGGz","12772",0,315,21,20,1,false,false,false,"","",false,"ne","Nepal","Member , House of Representatives (Kathmandu-4),  General Secretary, Nepali Congress. 🇳🇵","http://gaganthapa.com.np","http://gaganthapa.com.np",1292512,1248,1031,3738,6369,372,0,1292512,,,false,false,"https://pbs.twimg.com/profile_banners/93589182/1706327764","https://www.twitter.com/thapagk","https://pbs.twimg.com/profile_images/1752662263310213121/-7WSkFg2_normal.jpg",false,true,"11/30/2009, 2:07:10 PM","2/19/2024, 8:08:42 AM"
"1759240914227392722","thapagk","Gagan Thapa","Gagan","Thapa","संसदमा आज सम्माननीय प्रधानमन्त्री सँग मेरो प्रश्न - 'अर्थतन्त्रमा आएको समस्या र त्यसको सुधारको लागि के के काम गर्दै हुनुहुन्छ ? ' https://t.co/XDgcvL9TXb","46276",3,448,71,44,22,false,false,false,"","",false,"ne","Nepal","Member , House of Representatives (Kathmandu-4),  General Secretary, Nepali Congress. 🇳🇵","http://gaganthapa.com.np","http://gaganthapa.com.np",1292512,1248,1031,3738,6369,372,0,1292512,,,false,false,"https://pbs.twimg.com/profile_banners/93589182/1706327764","https://www.twitter.com/thapagk","https://pbs.twimg.com/profile_images/1752662263310213121/-7WSkFg2_normal.jpg",false,true,"11/30/2009, 2:07:10 PM","2/18/2024, 9:23:13 PM"
"1757594136050364772","thapagk","Gagan Thapa","Gagan","Thapa","सरस्वती मया दृष्टा वीणा पुस्तक धारिणी।।
हंस वाहन संयुक्ता विद्यादानं करोतु मे।।

सरस्वती पूजाको शुभकामना ! https://t.co/iEw3brb896","18608",0,505,11,17,0,false,false,false,"","",false,"hi","Nepal","Member , House of Representatives (Kathmandu-4),  General Secretary, Nepali Congress. 🇳🇵","http://gaganthapa.com.np","http://gaganthapa.com.np",1292512,1248,1031,3738,6369,372,0,1292512,,,false,false,"https://pbs.twimg.com/profile_banners/93589182/1706327764","https://www.twitter.com/thapagk","https://pbs.twimg.com/profile_images/1752662263310213121/-7WSkFg2_normal.jpg",false,true,"11/30/2009, 2:07:10 PM","2/14/2024, 8:19:31 AM"
"1756994049897017736","thapagk","Gagan Thapa","Gagan","Thapa","What a way to clinch a bilateral series!

Two individual centuries from Anil &amp; Bhim in a final match to make it a 3-0 series win against Canada.

Congratulations, Team Nepal ✨ #NEPvCAN 
📸:@CricketNep https://t.co/3kVjHUB2Hg","8633",0,209,11,19,2,false,false,false,"CricketNep","",false,"en","Nepal","Member , House of Representatives (Kathmandu-4),  General Secretary, Nepali Congress. 🇳🇵","http://gaganthapa.com.np","http://gaganthapa.com.np",1292512,1248,1031,3738,6369,372,0,1292512,,,false,false,"https://pbs.twimg.com/profile_banners/93589182/1706327764","https://www.twitter.com/thapagk","https://pbs.twimg.com/profile_images/1752662263310213121/-7WSkFg2_normal.jpg",false,true,"11/30/2009, 2:07:10 PM","2/12/2024, 4:34:59 PM"
"1756299966639636781","thapagk","Gagan Thapa","Gagan","Thapa","क्षेत्रका युवाहरूको रोजगारी र उद्यमशीलतालाई सहयोग पुर्‍याउने उद्देश्यले सुरु गरिएको Skill Up कार्यक्रमको पहिलो सत्र अन्तर्गत आज सांसद को कार्यालयले MS Excel Workshop को आयोजना गरेको छ । https://t.co/qeIyC6aNDQ","16118",1,208,104,23,4,false,false,false,"","",false,"ne","Nepal","Member , House of Representatives (Kathmandu-4),  General Secretary, Nepali Congress. 🇳🇵","http://gaganthapa.com.np","http://gaganthapa.com.np",1292512,1248,1031,3738,6369,372,0,1292512,,,false,false,"https://pbs.twimg.com/profile_banners/93589182/1706327764","https://www.twitter.com/thapagk","https://pbs.twimg.com/profile_images/1752662263310213121/-7WSkFg2_normal.jpg",false,true,"11/30/2009, 2:07:10 PM","2/10/2024, 6:36:57 PM"
"1756146592011497602","thapagk","Gagan Thapa","Gagan","Thapa","सोनाम ल्होसारको उपलक्ष्यमा सम्पूर्णमा हार्दिक शुभकामना ! https://t.co/YfWEubfzsr","9573",0,181,113,21,0,false,false,false,"","",false,"ne","Nepal","Member , House of Representatives (Kathmandu-4),  General Secretary, Nepali Congress. 🇳🇵","http://gaganthapa.com.np","http://gaganthapa.com.np",1292512,1248,1031,3738,6369,372,0,1292512,,,false,false,"https://pbs.twimg.com/profile_banners/93589182/1706327764","https://www.twitter.com/thapagk","https://pbs.twimg.com/profile_images/1752662263310213121/-7WSkFg2_normal.jpg",false,true,"11/30/2009, 2:07:10 PM","2/10/2024, 8:27:29 AM"
"1755260378194329976","thapagk","Gagan Thapa","Gagan","Thapa","संसदमा आज :  सदन र सरकारलाई परिणाममुखी बनाउने बारे कुरा

जबसम्म कार्यशैली फेरिँदैन परिणाम पनि फेरिँदैन। निर्देशन मात्रैले परिवर्तन ल्याउँछ भन्ने सोचबाट सरकार बाहिर आउनुपर्छ। उही काम गरेर फरक परिणामको अपेक्षा गर्नु मूर्खता मात्र हुन्छ यसको सुरुवात प्रधानमन्त्रीबाटै हुनुपर्छ । https://t.co/AgukBVjTdW","71959",2,259,88,29,11,false,false,false,"","",false,"ne","Nepal","Member , House of Representatives (Kathmandu-4),  General Secretary, Nepali Congress. 🇳🇵","http://gaganthapa.com.np","http://gaganthapa.com.np",1292512,1248,1031,3738,6369,372,0,1292512,,,false,false,"https://pbs.twimg.com/profile_banners/93589182/1706327764","https://www.twitter.com/thapagk","https://pbs.twimg.com/profile_images/1752662263310213121/-7WSkFg2_normal.jpg",false,true,"11/30/2009, 2:07:10 PM","2/7/2024, 9:45:59 PM"
"1755242115414581676","thapagk","Gagan Thapa","Gagan","Thapa","संसदमा आज :
अर्थतन्त्रमा केही सुधार आएको छ। सूचकाङ्क सकारात्मक बन्दै छन्। तर सकारात्मक सूचकाङ्कले पनि किन नागरिकलाई सहजता भएको छैन? आन्तरिक अर्थतन्त्रमा ठुलो शिथिलता आएको छ। पुँजीगत खर्च गर्न हामी सकिरहेका छैनौँ। यसको हल निकाली नागरिकलाई अर्थतन्त्र फेरि लयमा फर्कने छ भनेर आशा दिन… https://t.co/qZwhhokak1","26603",2,271,48,41,6,false,false,false,"","",false,"ne","Nepal","Member , House of Representatives (Kathmandu-4),  General Secretary, Nepali Congress. 🇳🇵","http://gaganthapa.com.np","http://gaganthapa.com.np",1292512,1248,1031,3738,6369,372,0,1292512,,,false,false,"https://pbs.twimg.com/profile_banners/93589182/1706327764","https://www.twitter.com/thapagk","https://pbs.twimg.com/profile_images/1752662263310213121/-7WSkFg2_normal.jpg",false,true,"11/30/2009, 2:07:10 PM","2/7/2024, 8:33:25 PM"
"1755225428380307963","thapagk","Gagan Thapa","Gagan","Thapa","संसदमा आज - स्वास्थ्यका कुरा : 

स्वास्थ्य बिमा ऐनको प्रभावकारी कार्यान्वयन गरौँ। सबै नेपालीको अनिवार्य स्वास्थ्य बिमा र बिमा मार्फत गुणस्तरीय स्वास्थ्य सेवा सुनिश्चित गरौँ । https://t.co/CQOZQY9a4A","9804",3,171,43,33,5,false,false,false,"","",false,"ne","Nepal","Member , House of Representatives (Kathmandu-4),  General Secretary, Nepali Congress. 🇳🇵","http://gaganthapa.com.np","http://gaganthapa.com.np",1292512,1248,1031,3738,6369,372,0,1292512,,,false,false,"https://pbs.twimg.com/profile_banners/93589182/1706327764","https://www.twitter.com/thapagk","https://pbs.twimg.com/profile_images/1752662263310213121/-7WSkFg2_normal.jpg",false,true,"11/30/2009, 2:07:10 PM","2/7/2024, 7:27:07 PM"
"1755205883196264544","thapagk","Gagan Thapa","Gagan","Thapa","आज संसदमा -

विद्यालयका बालबालिकाको सिकाइको स्तर चिन्ताजनक छ। विश्वविद्यालयमा हुने राजनीतिक हस्तक्षेपले त्यहाँको पढाइको गुणस्तरमा असर त परेको छ नै विद्यार्थीहरूमा नैराश्यता बढेको छ। शिक्षा सुधारका विषयमा सरकारले तत्काल गर्न सक्ने सुधारहरूमा अब कति पनि ढिलाई गर्नु हुँदैन। https://t.co/ec5tymTLml","15010",1,230,75,52,4,false,false,false,"","",false,"ne","Nepal","Member , House of Representatives (Kathmandu-4),  General Secretary, Nepali Congress. 🇳🇵","http://gaganthapa.com.np","http://gaganthapa.com.np",1292512,1248,1031,3738,6369,372,0,1292512,,,false,false,"https://pbs.twimg.com/profile_banners/93589182/1706327764","https://www.twitter.com/thapagk","https://pbs.twimg.com/profile_images/1752662263310213121/-7WSkFg2_normal.jpg",false,true,"11/30/2009, 2:07:10 PM","2/7/2024, 6:09:27 PM"
"1755193381297238269","thapagk","Gagan Thapa","Gagan","Thapa","जो सुकै होस् । जति सुकै शक्तिशाली होस् ।
राजनीतिक होस् कि आर्थिक शक्ति होस् ।
चाहे जग्गा मिच्ने होस्, चाहे नागरिकताको कीर्ते गर्ने होस् ।
चाहे सहकारीमा ठग्ने होस् । यताको होस् । उताको होस् ।
कसैले पनि उन्मुक्ति पाउनु हुँदैन ।

आज संसदमा … https://t.co/KHpYqnKgmm","87831",3,508,194,96,74,false,false,false,"","",false,"ne","Nepal","Member , House of Representatives (Kathmandu-4),  General Secretary, Nepali Congress. 🇳🇵","http://gaganthapa.com.np","http://gaganthapa.com.np",1292512,1248,1031,3738,6369,372,0,1292512,,,false,false,"https://pbs.twimg.com/profile_banners/93589182/1706327764","https://www.twitter.com/thapagk","https://pbs.twimg.com/profile_images/1752662263310213121/-7WSkFg2_normal.jpg",false,true,"11/30/2009, 2:07:10 PM","2/7/2024, 5:19:46 PM"
"1754824206393528682","thapagk","Gagan Thapa","Gagan","Thapa","The first session of the Skill Up series is here!
Skill Up is a monthly initiative of the Office of MP designed for the Youths of Kathmandu Constituency 4. The program aims to support the youths in the constituency by providing them with a platform that can help them nurture… https://t.co/d7Ob6FFwca","8905",0,108,4,15,3,false,false,false,"","",false,"en","Nepal","Member , House of Representatives (Kathmandu-4),  General Secretary, Nepali Congress. 🇳🇵","http://gaganthapa.com.np","http://gaganthapa.com.np",1292512,1248,1031,3738,6369,372,0,1292512,,,false,false,"https://pbs.twimg.com/profile_banners/93589182/1706327764","https://www.twitter.com/thapagk","https://pbs.twimg.com/profile_images/1752662263310213121/-7WSkFg2_normal.jpg",false,true,"11/30/2009, 2:07:10 PM","2/6/2024, 4:52:48 PM"
