"tweet_id","username","name","first_name","last_name","full_text","view_count","bookmark_count","favorite_count","reply_count","retweet_count","quote_count","bookmarked","favorited","retweeted","user_mentions","url_mentions","is_quote_status","lang","location","bio","website","websites","followers_count","following_count","media_count","statuses_count","favourites_count","listed_count","fast_followers_count","normal_followers_count","followed_by","following","can_dm","can_media_tag","profile_banner_url","profile_url","avatar_url","verified","is_blue_verified","user_created_at","created_at"
"1754745382041526639","thapagk","Gagan Thapa","Gagan","Thapa","नेपाली कांग्रेसका निष्ठावान नेता,केन्द्रीय सदस्य केशवकुमार बुढाथोकीको असामयिक निधनमा पार्टी शोकमा भएकोले समुदायमा कांग्रेस अभियानका कार्यक्रम हाललाई स्थगित गरिएको छ।संवाद यात्राका स्थगित कार्यक्रमहरू पछि मिति तय गरी सोही स्थानबाट पुनः सुचारु हुनेछन। https://t.co/JFAcqKFC2g","11468",1,162,7,20,0,false,false,false,"","",false,"ne","Nepal","Member , House of Representatives (Kathmandu-4),  General Secretary, Nepali Congress. 🇳🇵","http://gaganthapa.com.np","http://gaganthapa.com.np",1292512,1248,1031,3738,6369,372,0,1292512,,,false,false,"https://pbs.twimg.com/profile_banners/93589182/1706327764","https://www.twitter.com/thapagk","https://pbs.twimg.com/profile_images/1752662263310213121/-7WSkFg2_normal.jpg",false,true,"11/30/2009, 2:07:10 PM","2/6/2024, 11:39:35 AM"
"1754704213550965143","thapagk","Gagan Thapa","Gagan","Thapa","नेपाली कांग्रेसका एक निष्ठावान् योद्धा, केन्द्रीय सदस्य, पूर्व मन्त्री केशवकुमार बुढाथोकीको विराट मेडिकल कलेज विराटनगरमा उपचारका क्रममा निधन भएको खवरले अत्यन्तै मर्माहत बनाएको छ। उहाँको आत्माको चिर शान्तिको कामना गर्दै शोक सन्तप्त परिवार प्रति समवेदना प्रकट गर्दछु। https://t.co/jvg3AImv5b","10424",0,119,25,6,2,false,false,false,"","",false,"ne","Nepal","Member , House of Representatives (Kathmandu-4),  General Secretary, Nepali Congress. 🇳🇵","http://gaganthapa.com.np","http://gaganthapa.com.np",1292512,1248,1031,3738,6369,372,0,1292512,,,false,false,"https://pbs.twimg.com/profile_banners/93589182/1706327764","https://www.twitter.com/thapagk","https://pbs.twimg.com/profile_images/1752662263310213121/-7WSkFg2_normal.jpg",false,true,"11/30/2009, 2:07:10 PM","2/6/2024, 8:55:59 AM"
"1754135350409384013","thapagk","Gagan Thapa","Gagan","Thapa","*समुदायमा कांग्रेस अभियान अन्तर्गत संवाद यात्राका क्रममा पर्सामा*
खुला संवाद, पत्रकार संवाद, उद्योग व्यवसायी संवाद र पार्टी भेटघाटमा म सहित सहमहामन्त्रीहरू बद्री पाण्डे र जीवन परियारजी लगायत पार्टीका साथीहरूको अन्तरक्रिया।
संवाद तथा सरोकारवालासंग भेटघाटको क्रममा स्थानीयवासीले… https://t.co/WrCVCdzKDU","20742",0,246,26,30,5,false,false,false,"","",false,"ne","Nepal","Member , House of Representatives (Kathmandu-4),  General Secretary, Nepali Congress. 🇳🇵","http://gaganthapa.com.np","http://gaganthapa.com.np",1292512,1248,1031,3738,6369,372,0,1292512,,,false,false,"https://pbs.twimg.com/profile_banners/93589182/1706327764","https://www.twitter.com/thapagk","https://pbs.twimg.com/profile_images/1752662263310213121/-7WSkFg2_normal.jpg",false,true,"11/30/2009, 2:07:10 PM","2/4/2024, 7:15:32 PM"
"1753767928632365287","thapagk","Gagan Thapa","Gagan","Thapa","*समुदायमा कांग्रेस अभियान अन्तर्गत संवाद यात्राका क्रममा बारामा*
समुदायमा खुला संवाद, युवा संवाद, कृषि संवाद, पर्यावरण र श्रम संवाद तथा पार्टीका साथीहरूसंगको भेटघाट र अन्तरक्रिया। संवादका क्रममा युवा र रोजगारीको विषय, कृषि उत्पादन, सिंचाइ र मलको विषय, वन विनास र पर्यावरणको विषय,… https://t.co/7usyvWOCNI","15045",0,255,17,23,7,false,false,false,"","",false,"ne","Nepal","Member , House of Representatives (Kathmandu-4),  General Secretary, Nepali Congress. 🇳🇵","http://gaganthapa.com.np","http://gaganthapa.com.np",1292512,1248,1031,3738,6369,372,0,1292512,,,false,false,"https://pbs.twimg.com/profile_banners/93589182/1706327764","https://www.twitter.com/thapagk","https://pbs.twimg.com/profile_images/1752662263310213121/-7WSkFg2_normal.jpg",false,true,"11/30/2009, 2:07:10 PM","2/3/2024, 6:55:32 PM"
"1753620390469837242","thapagk","Gagan Thapa","Gagan","Thapa","समुदायमा कांग्रेस अभियान अन्तर्गत संवाद यात्राका क्रममा रौतहटमा
खुला संवाद तथा सरोकारवालासंग भेटघाटको क्रममा स्थानीयवासीले डुबानको विषय, चिनी मिल नभएको कारण हुने समस्या, विद्यालयमा शिक्षकको अभाव, वैदेशिक रोजगारमा फ्रि भिषा भन्दै ठगिएको लगायतका विषय उठाउनुभयो। https://t.co/bUl2obrLSD","11044",0,228,10,20,3,false,false,false,"","",false,"ne","Nepal","Member , House of Representatives (Kathmandu-4),  General Secretary, Nepali Congress. 🇳🇵","http://gaganthapa.com.np","http://gaganthapa.com.np",1292512,1248,1031,3738,6369,372,0,1292512,,,false,false,"https://pbs.twimg.com/profile_banners/93589182/1706327764","https://www.twitter.com/thapagk","https://pbs.twimg.com/profile_images/1752662263310213121/-7WSkFg2_normal.jpg",false,true,"11/30/2009, 2:07:10 PM","2/3/2024, 9:09:16 AM"
"1753406416550035707","thapagk","Gagan Thapa","Gagan","Thapa","*समुदायमा कांग्रेस अभियान अन्तर्गत संवाद यात्राका क्रममा सर्लाहीमा*
कौडेना गाउँपालिकाले संचालन गरेको सामुदायिक अस्पतालको अवलोकन, मलङगवा लगायत भिभिन्न ठाउँमा खुला संवाद तथा सरोकारवालासंग भेटघाट। संवादको क्रममा स्थानीयवासीले प्रशासन कार्यालयहरुमा हुने समस्या, मलको उपलब्धता र असमान… https://t.co/DSpf0bzyje","9572",0,165,16,10,1,false,false,false,"","",false,"ne","Nepal","Member , House of Representatives (Kathmandu-4),  General Secretary, Nepali Congress. 🇳🇵","http://gaganthapa.com.np","http://gaganthapa.com.np",1292512,1248,1031,3738,6369,372,0,1292512,,,false,false,"https://pbs.twimg.com/profile_banners/93589182/1706327764","https://www.twitter.com/thapagk","https://pbs.twimg.com/profile_images/1752662263310213121/-7WSkFg2_normal.jpg",false,true,"11/30/2009, 2:07:10 PM","2/2/2024, 6:59:01 PM"
"1753351497641824294","thapagk","Gagan Thapa","Gagan","Thapa","*समुदायमा कांग्रेस अभियान अन्तर्गत संवाद यात्राका क्रममा महोत्तरीमा*
बलवामा परौल स्थानको दर्शन, सम्सीमा शहीद शिवचन्द्र मिश्रको सालिक अनावरण। लोहारपट्टी, बलवा, मनरा सिस्वा, सम्सीमा समुदायमा खुला संवाद तथा सरोकारवालासंगको छलफल र अवलोकनका क्रममा स्थानीयवासीले 'लम्पी स्किन' बाट… https://t.co/ch2vHNC0iL","10560",1,192,18,19,2,false,false,false,"","",false,"ne","Nepal","Member , House of Representatives (Kathmandu-4),  General Secretary, Nepali Congress. 🇳🇵","http://gaganthapa.com.np","http://gaganthapa.com.np",1292512,1248,1031,3738,6369,372,0,1292512,,,false,false,"https://pbs.twimg.com/profile_banners/93589182/1706327764","https://www.twitter.com/thapagk","https://pbs.twimg.com/profile_images/1752662263310213121/-7WSkFg2_normal.jpg",false,true,"11/30/2009, 2:07:10 PM","2/2/2024, 3:20:47 PM"
"1753000105517707364","thapagk","Gagan Thapa","Gagan","Thapa","समुदायमा कांग्रेस अभियान अन्तर्गत संवाद यात्राका क्रममा सिरहा जिल्लामा प्राविधिक शिक्षालयको आवश्कता, दलित आरक्षण मध्य मधेशी दलित समुदायको सहभागिताको विषय, तराईमा बढ्दो लागू पदार्थ दुर्व्यसन समस्या, कृषि कोल्ड स्टोरको आवश्यकता, सिंचाई सुविधाको विषय, विकास निर्माणमा ढिलासुस्ती… https://t.co/0HXUybxLuR","8884",0,155,8,16,3,false,false,false,"","",false,"ne","Nepal","Member , House of Representatives (Kathmandu-4),  General Secretary, Nepali Congress. 🇳🇵","http://gaganthapa.com.np","http://gaganthapa.com.np",1292512,1248,1031,3738,6369,372,0,1292512,,,false,false,"https://pbs.twimg.com/profile_banners/93589182/1706327764","https://www.twitter.com/thapagk","https://pbs.twimg.com/profile_images/1752662263310213121/-7WSkFg2_normal.jpg",false,true,"11/30/2009, 2:07:10 PM","2/1/2024, 4:04:28 PM"
"1752697281000902752","thapagk","Gagan Thapa","Gagan","Thapa","यात्राको क्रममा सप्तरी राजविराजको गजेन्द्र नारायण सिहं अस्पतालमा। त्यहाँ बालबच्चाको कुपोषण, कार्यरत स्वास्थ्यकर्मीका समस्या लगायत भवन हस्तान्तरणको विषयमा कुराहरु भयो! https://t.co/SCz6B4bmtH","19043",0,308,20,39,2,false,false,false,"","",false,"ne","Nepal","Member , House of Representatives (Kathmandu-4),  General Secretary, Nepali Congress. 🇳🇵","http://gaganthapa.com.np","http://gaganthapa.com.np",1292512,1248,1031,3738,6369,372,0,1292512,,,false,false,"https://pbs.twimg.com/profile_banners/93589182/1706327764","https://www.twitter.com/thapagk","https://pbs.twimg.com/profile_images/1752662263310213121/-7WSkFg2_normal.jpg",false,true,"11/30/2009, 2:07:10 PM","1/31/2024, 8:01:09 PM"
"1752351574742258058","thapagk","Gagan Thapa","Gagan","Thapa","""समुदायमा कांग्रेस"" अभियान अन्तर्गत आज शहीद दिवसको दिन देशभर वडा तहका कार्यक्रम सुरु भएका छन। आज म आफू क्रियाशील रहेको का.म.न.पा वडा न. ३० को कार्यक्रममा सहभागी हुनको लागि 'संवाद यात्रा' एक दिनको लागी थाती राख्दै काठमाडौँ आएको छु। आज यहाँ अभियान अन्तर्गत 'सम्पदा सरसफाई' कार्यक्रम… https://t.co/NCtS4spWnb","14141",1,202,10,20,3,false,false,false,"","",false,"ne","Nepal","Member , House of Representatives (Kathmandu-4),  General Secretary, Nepali Congress. 🇳🇵","http://gaganthapa.com.np","http://gaganthapa.com.np",1292512,1248,1031,3738,6369,372,0,1292512,,,false,false,"https://pbs.twimg.com/profile_banners/93589182/1706327764","https://www.twitter.com/thapagk","https://pbs.twimg.com/profile_images/1752662263310213121/-7WSkFg2_normal.jpg",false,true,"11/30/2009, 2:07:10 PM","1/30/2024, 9:07:27 PM"
"1752269456234201581","thapagk","Gagan Thapa","Gagan","Thapa","आज शहीद दिवस!
स्वतन्त्रता र जनअधिकारका लागि प्राण आहुति दिने सम्पूर्ण ज्ञात अज्ञात शहीदहरूमा हार्दिक नमन ! 
समुदायमा कांग्रेस अभियान अन्तर्गत संवाद यात्राका क्रममा आजै आदरणीय गुरू घिमिरे सहित हामी धनुषा शहीद नगर यदुकुहामा पुगेर शहीद कामेश्वर मण्डल, कुशेश्वर यादवको सालिकमा… https://t.co/0XPiZFulz8","11479",0,175,10,8,2,false,false,false,"","https://twitter.com/thapagk/status/1752269456234201581/photo/1",false,"ne","Nepal","Member , House of Representatives (Kathmandu-4),  General Secretary, Nepali Congress. 🇳🇵","http://gaganthapa.com.np","http://gaganthapa.com.np",1292512,1248,1031,3738,6369,372,0,1292512,,,false,false,"https://pbs.twimg.com/profile_banners/93589182/1706327764","https://www.twitter.com/thapagk","https://pbs.twimg.com/profile_images/1752662263310213121/-7WSkFg2_normal.jpg",false,true,"11/30/2009, 2:07:10 PM","1/30/2024, 3:41:08 PM"
"1752029453646233861","thapagk","Gagan Thapa","Gagan","Thapa","हामी अहिले राती ११ बजिसक्दा पनि सिराहा ओैरहीका कृषक तथा स्थानीयहरू सँग संवादमा छौँ।

सिराहा आइपुग्दा थोरै ढिला भएकाले पूर्वनिर्धारित ठाउँमा थोरै ढिला नै पुगियो। तर चिसो, रात केही नभनी यति अबेर सम्म म सँग भेटेर संवाद गर्न कुरेर बसिदिनु भएकोमा औरहीवासी लाई नमन! https://t.co/LPw1t8Szo5","24829",1,393,67,29,6,false,false,false,"","",false,"ne","Nepal","Member , House of Representatives (Kathmandu-4),  General Secretary, Nepali Congress. 🇳🇵","http://gaganthapa.com.np","http://gaganthapa.com.np",1292512,1248,1031,3738,6369,372,0,1292512,,,false,false,"https://pbs.twimg.com/profile_banners/93589182/1706327764","https://www.twitter.com/thapagk","https://pbs.twimg.com/profile_images/1752662263310213121/-7WSkFg2_normal.jpg",false,true,"11/30/2009, 2:07:10 PM","1/29/2024, 11:47:27 PM"
"1751977059805692181","thapagk","Gagan Thapa","Gagan","Thapa","समुदायमा कांग्रेस अभियान सप्तरीमा

सप्तरीमा हिजो बेलुका आयौँ र आज दिउसोभर जसो यहीँ रह्यौ। सप्तरीमा रहँदा राजविराजको गजेन्द्र नारायण सिंह अस्पताल, डाग्नेश्वरीको पत्थरगढा, बोदेबर्साइनमा पार्टीका साथीहरूका साथमा स्थानीय आम समुदायसँग खुल्ला संवाद र भेटघाट गर्‍यौ। सप्तरी बासीको माया,… https://t.co/E4Jxu6UsSm","15459",1,267,35,25,4,false,false,false,"","",false,"ne","Nepal","Member , House of Representatives (Kathmandu-4),  General Secretary, Nepali Congress. 🇳🇵","http://gaganthapa.com.np","http://gaganthapa.com.np",1292512,1248,1031,3738,6369,372,0,1292512,,,false,false,"https://pbs.twimg.com/profile_banners/93589182/1706327764","https://www.twitter.com/thapagk","https://pbs.twimg.com/profile_images/1752662263310213121/-7WSkFg2_normal.jpg",false,true,"11/30/2009, 2:07:10 PM","1/29/2024, 8:19:15 PM"
"1751553853114274065","thapagk","Gagan Thapa","Gagan","Thapa","आज नेपालको लोकतान्त्रिक आन्दोलन र महिला मुक्ति आन्दोलनको योद्धा श्रद्धेय नोना कोइरालाको स्मृति दिवस!
समुदायमा कांग्रेस अभियानका क्रममा आजै विराटनगरस्थित पार्टी कार्यालय पुगेर उहाँको सालिकमा माल्यार्पण गर्ने अवसर मिल्यो।
उहाँप्रति हार्दिक श्रद्धाञ्जली! https://t.co/bc19LePlbe","8229",0,155,11,7,0,false,false,false,"","",false,"ne","Nepal","Member , House of Representatives (Kathmandu-4),  General Secretary, Nepali Congress. 🇳🇵","http://gaganthapa.com.np","http://gaganthapa.com.np",1292512,1248,1031,3738,6369,372,0,1292512,,,false,false,"https://pbs.twimg.com/profile_banners/93589182/1706327764","https://www.twitter.com/thapagk","https://pbs.twimg.com/profile_images/1752662263310213121/-7WSkFg2_normal.jpg",false,true,"11/30/2009, 2:07:10 PM","1/28/2024, 4:17:35 PM"
"1751260197392466316","thapagk","Gagan Thapa","Gagan","Thapa","आजबाट 'समुदायमा कांग्रेस अभियान' प्रारम्भ भयो!
हामी, हाम्रो अभियान मेची पुलबाट सुरु गरेर, कञ्चनश्री, झापा बजार, कञ्जीवारी, खजुरगाछी हुँदै अहिले मोरङ आइपुगेका छौँ।
हामीले अभियानको क्रममा यात्रा गर्ने घोषणा पछि सबैजनाले 'कम सुनाउने बढी सुन्ने गर्नुपर्छ है!' भनेर सुझाव दिनुभएको छ।… https://t.co/nYsbUxaALy","37107",1,403,73,50,12,false,false,false,"","",false,"ne","Nepal","Member , House of Representatives (Kathmandu-4),  General Secretary, Nepali Congress. 🇳🇵","http://gaganthapa.com.np","http://gaganthapa.com.np",1292512,1248,1031,3738,6369,372,0,1292512,,,false,false,"https://pbs.twimg.com/profile_banners/93589182/1706327764","https://www.twitter.com/thapagk","https://pbs.twimg.com/profile_images/1752662263310213121/-7WSkFg2_normal.jpg",false,true,"11/30/2009, 2:07:10 PM","1/27/2024, 8:50:42 PM"
"1750831549413540172","thapagk","Gagan Thapa","Gagan","Thapa","काठमाडौं क्षेत्र नं ४ मा सार्वजनिक शौचालय सहितको बगैंचा एवं चालू आर्थिक बर्ष २०८०/०८१ का याेजनाहरूकाे (सडक) अनुगमन तथा अन्तरक्रिया । २०८० माघ १२ https://t.co/c0L2lIJg6t","17189",0,190,22,11,4,false,false,false,"","",false,"ne","Nepal","Member , House of Representatives (Kathmandu-4),  General Secretary, Nepali Congress. 🇳🇵","http://gaganthapa.com.np","http://gaganthapa.com.np",1292512,1248,1031,3738,6369,372,0,1292512,,,false,false,"https://pbs.twimg.com/profile_banners/93589182/1706327764","https://www.twitter.com/thapagk","https://pbs.twimg.com/profile_images/1752662263310213121/-7WSkFg2_normal.jpg",false,true,"11/30/2009, 2:07:10 PM","1/26/2024, 4:27:24 PM"
"1750741700614512847","thapagk","Gagan Thapa","Gagan","Thapa","आज माघ १२, नेपाली कांग्रेसको ७८औँ स्थापना दिवस!

यस अवसरमा सबै कांग्रेस कार्यकर्ता तथा शुभेच्छुकहरूमा शुभकामना! पार्टी स्थापनाकाल देखि आजसम्म पार्टी निर्माणमा योगदान पुर्‍याउनुहुने सम्पूर्ण श्रद्धेय नेतागण, बलिदानी दिने सहिद तथा योद्धाहरू प्रति हार्दिक नमन गर्न चाहन्छु। हामीले,… https://t.co/aJISqriGcj","35829",2,302,84,35,17,false,false,false,"","",false,"ne","Nepal","Member , House of Representatives (Kathmandu-4),  General Secretary, Nepali Congress. 🇳🇵","http://gaganthapa.com.np","http://gaganthapa.com.np",1292512,1248,1031,3738,6369,372,0,1292512,,,false,false,"https://pbs.twimg.com/profile_banners/93589182/1706327764","https://www.twitter.com/thapagk","https://pbs.twimg.com/profile_images/1752662263310213121/-7WSkFg2_normal.jpg",false,true,"11/30/2009, 2:07:10 PM","1/26/2024, 10:30:23 AM"
"1750493624301760853","thapagk","Gagan Thapa","Gagan","Thapa","राष्ट्रिय सभा सदस्यमा निर्वाचित हुनुहुने सबैमा हार्दिक बधाई तथा सफल कार्यकालको शुभकामना !","38328",0,268,86,13,18,false,false,false,"","",false,"ne","Nepal","Member , House of Representatives (Kathmandu-4),  General Secretary, Nepali Congress. 🇳🇵","http://gaganthapa.com.np","http://gaganthapa.com.np",1292512,1248,1031,3738,6369,372,0,1292512,,,false,false,"https://pbs.twimg.com/profile_banners/93589182/1706327764","https://www.twitter.com/thapagk","https://pbs.twimg.com/profile_images/1752662263310213121/-7WSkFg2_normal.jpg",false,true,"11/30/2009, 2:07:10 PM","1/25/2024, 6:04:37 PM"
"1749755468824588667","thapagk","Gagan Thapa","Gagan","Thapa","संवाद यात्रा
अब तपाईँसँग मेरो भेट तपाईँकै गाउँमा, तपाईंकै ठाउँमा !
समुदायमा कांग्रेस अभियान अन्तर्गत म माघ १३ गते भद्रपुर वडा नं.५ मेचीपुल भन्सारबाट तपाईँसंगको संवाद यात्रामा हुनेछु। https://t.co/BCj6Oe5Unu","121488",3,497,160,85,89,false,false,false,"","",false,"ne","Nepal","Member , House of Representatives (Kathmandu-4),  General Secretary, Nepali Congress. 🇳🇵","http://gaganthapa.com.np","http://gaganthapa.com.np",1292512,1248,1031,3738,6369,372,0,1292512,,,false,false,"https://pbs.twimg.com/profile_banners/93589182/1706327764","https://www.twitter.com/thapagk","https://pbs.twimg.com/profile_images/1752662263310213121/-7WSkFg2_normal.jpg",false,true,"11/30/2009, 2:07:10 PM","1/23/2024, 5:11:27 PM"
"1748881123579695290","thapagk","Gagan Thapa","Gagan","Thapa","आज न्यूजिल्याण्डसंग को पहिलो खेल संगै विश्व कपको सबै खेलमा उत्कृष्ट प्रदर्शनीको हार्दिक शुभकामना ! Best Wishes Boys https://t.co/DuNTuhbonX","17664",0,307,25,17,3,false,false,false,"","",false,"ne","Nepal","Member , House of Representatives (Kathmandu-4),  General Secretary, Nepali Congress. 🇳🇵","http://gaganthapa.com.np","http://gaganthapa.com.np",1292512,1248,1031,3738,6369,372,0,1292512,,,false,false,"https://pbs.twimg.com/profile_banners/93589182/1706327764","https://www.twitter.com/thapagk","https://pbs.twimg.com/profile_images/1752662263310213121/-7WSkFg2_normal.jpg",false,true,"11/30/2009, 2:07:10 PM","1/21/2024, 7:17:07 AM"
