"tweet_id","username","name","first_name","last_name","full_text","view_count","bookmark_count","favorite_count","reply_count","retweet_count","quote_count","bookmarked","favorited","retweeted","user_mentions","url_mentions","is_quote_status","lang","location","bio","website","websites","followers_count","following_count","media_count","statuses_count","favourites_count","listed_count","fast_followers_count","normal_followers_count","followed_by","following","can_dm","can_media_tag","profile_banner_url","profile_url","avatar_url","verified","is_blue_verified","user_created_at","created_at"
"1746723556476764543","thapagk","Gagan Thapa","Gagan","Thapa","माघे संक्रान्ति, माघी, मकर स्नान, घ्यु चाकु खाने दिनको उपलक्ष्यमा सम्पूर्णमा हार्दिक मंगलमय शुभकामना !","21993",0,269,25,10,0,false,false,false,"","",false,"ne","Nepal","Member , House of Representatives (Kathmandu-4),  General Secretary, Nepali Congress. 🇳🇵","http://gaganthapa.com.np","http://gaganthapa.com.np",1292512,1248,1031,3738,6369,372,0,1292512,,,false,false,"https://pbs.twimg.com/profile_banners/93589182/1706327764","https://www.twitter.com/thapagk","https://pbs.twimg.com/profile_images/1752662263310213121/-7WSkFg2_normal.jpg",false,true,"11/30/2009, 2:07:10 PM","1/15/2024, 8:23:43 AM"
"1741406131921310087","thapagk","Gagan Thapa","Gagan","Thapa","तमु ल्होसार २०८० को पावम अवसरमा देश विदेशमा रहनुभएका सम्पूर्ण नेपाली दाजुभाइ दिदीबहिनीहरूमा हार्दिक मंगलमय शुभकामना!","23436",0,186,34,12,1,false,false,false,"","",false,"ne","Nepal","Member , House of Representatives (Kathmandu-4),  General Secretary, Nepali Congress. 🇳🇵","http://gaganthapa.com.np","http://gaganthapa.com.np",1292512,1248,1031,3738,6369,372,0,1292512,,,false,false,"https://pbs.twimg.com/profile_banners/93589182/1706327764","https://www.twitter.com/thapagk","https://pbs.twimg.com/profile_images/1752662263310213121/-7WSkFg2_normal.jpg",false,true,"11/30/2009, 2:07:10 PM","12/31/2023, 4:14:10 PM"
"1740004055299371104","thapagk","Gagan Thapa","Gagan","Thapa","मेरा मित्र तथा कांग्रेसका एक निष्ठावान् योद्धा, नेपाली कांग्रेस रामेछाप-काठमाडौँ सम्पर्क समितिका सभापति राजनारायण श्रेष्ठको असामयिक निधन भएको खबरले अत्यन्तै मर्माहत बनाएको छ। उहाँको आत्माको चिर शान्तिको कामना गर्दै शोक सन्तप्त परिवार प्रति समवेदना प्रकट गर्दछु। https://t.co/UOKCrLbW6s","14748",0,147,22,7,1,false,false,false,"","",false,"ne","Nepal","Member , House of Representatives (Kathmandu-4),  General Secretary, Nepali Congress. 🇳🇵","http://gaganthapa.com.np","http://gaganthapa.com.np",1292512,1248,1031,3738,6369,372,0,1292512,,,false,false,"https://pbs.twimg.com/profile_banners/93589182/1706327764","https://www.twitter.com/thapagk","https://pbs.twimg.com/profile_images/1752662263310213121/-7WSkFg2_normal.jpg",false,true,"11/30/2009, 2:07:10 PM","12/27/2023, 7:22:49 PM"
"1739523791557124526","thapagk","Gagan Thapa","Gagan","Thapa","धान्य पूर्णिमा,उधौली पर्व र य:मरी पुन्हीको उपलक्ष्यमा देशभित्र र बाहिर रहनुभएका सम्पूर्ण नेपाली दिदीबहिनी दाजुभाइहरूमा हार्दिक मङ्गलमय शुभकामना !","14241",0,152,14,9,0,false,false,false,"","",false,"ne","Nepal","Member , House of Representatives (Kathmandu-4),  General Secretary, Nepali Congress. 🇳🇵","http://gaganthapa.com.np","http://gaganthapa.com.np",1292512,1248,1031,3738,6369,372,0,1292512,,,false,false,"https://pbs.twimg.com/profile_banners/93589182/1706327764","https://www.twitter.com/thapagk","https://pbs.twimg.com/profile_images/1752662263310213121/-7WSkFg2_normal.jpg",false,true,"11/30/2009, 2:07:10 PM","12/26/2023, 11:34:25 AM"
"1739261111600644173","thapagk","Gagan Thapa","Gagan","Thapa","उदयपुर कटारी अस्पतालमा अस्पताल व्यवस्थापन, सेवा प्रवाहको अवस्था र समन्वय लगायतका विषयमा जनप्रतिनिधि र अस्पताल टीम संगको छलफल। https://t.co/IxOxRMNEm7","33517",0,324,20,35,12,false,false,false,"","",false,"ne","Nepal","Member , House of Representatives (Kathmandu-4),  General Secretary, Nepali Congress. 🇳🇵","http://gaganthapa.com.np","http://gaganthapa.com.np",1292512,1248,1031,3738,6369,372,0,1292512,,,false,false,"https://pbs.twimg.com/profile_banners/93589182/1706327764","https://www.twitter.com/thapagk","https://pbs.twimg.com/profile_images/1752662263310213121/-7WSkFg2_normal.jpg",false,true,"11/30/2009, 2:07:10 PM","12/25/2023, 6:10:37 PM"
"1739155490914062419","thapagk","Gagan Thapa","Gagan","Thapa","क्रिसमसको उपलक्ष्यमा सम्पूर्ण ईसाई धर्मावलम्वीहरूमा हार्दिक मंगलमय शुभकामना !","21314",0,150,19,3,4,false,false,false,"","",false,"ne","Nepal","Member , House of Representatives (Kathmandu-4),  General Secretary, Nepali Congress. 🇳🇵","http://gaganthapa.com.np","http://gaganthapa.com.np",1292512,1248,1031,3738,6369,372,0,1292512,,,false,false,"https://pbs.twimg.com/profile_banners/93589182/1706327764","https://www.twitter.com/thapagk","https://pbs.twimg.com/profile_images/1752662263310213121/-7WSkFg2_normal.jpg",false,true,"11/30/2009, 2:07:10 PM","12/25/2023, 11:10:55 AM"
"1738939314640388453","thapagk","Gagan Thapa","Gagan","Thapa","आज श्रद्धेय: नेता कृष्ण प्रसाद भट्टराईको शताब्दी जन्म दिवस!
लोकतान्त्रिक आन्दोलनमा उहाँको योगदान र आजको सन्दर्भबारे आज पार्टी कार्यालय, सानेपामा विमर्श गर्यौं। विमर्श सभामा पाल्नुभएका वक्ताद्वय श्री निलाम्बर आचार्य र श्री सिके लाल एवं सहजकर्ता डा. नवराज लम्सालप्रति कृतज्ञता… https://t.co/MruF2g5imO","31599",0,339,202,24,7,false,false,false,"","",false,"ne","Nepal","Member , House of Representatives (Kathmandu-4),  General Secretary, Nepali Congress. 🇳🇵","http://gaganthapa.com.np","http://gaganthapa.com.np",1292512,1248,1031,3738,6369,372,0,1292512,,,false,false,"https://pbs.twimg.com/profile_banners/93589182/1706327764","https://www.twitter.com/thapagk","https://pbs.twimg.com/profile_images/1752662263310213121/-7WSkFg2_normal.jpg",false,true,"11/30/2009, 2:07:10 PM","12/24/2023, 8:51:55 PM"
"1738561514460922084","thapagk","Gagan Thapa","Gagan","Thapa","२०७९ को आम चुनावबाट निर्वाचित भएर म तपाईँको सांसदको रूपमा शपथ खाएको आज ठिक एक वर्ष भएको छ। निर्वाचनका क्रममा मैले तपाईंको जनप्रतिनिधि भएर गरेका प्रयासलाई तपाईंहरू समक्ष आवधिक रुपमा प्रस्तुत गर्ने बाचा गरेको थिएं। त्यसै अनुसार यो भिडियो मार्फत मैले यस एक वर्षमा गरेका कामहरू… https://t.co/9RhkfAEj8I","38793",7,474,67,53,13,false,false,false,"","",false,"ne","Nepal","Member , House of Representatives (Kathmandu-4),  General Secretary, Nepali Congress. 🇳🇵","http://gaganthapa.com.np","http://gaganthapa.com.np",1292512,1248,1031,3738,6369,372,0,1292512,,,false,false,"https://pbs.twimg.com/profile_banners/93589182/1706327764","https://www.twitter.com/thapagk","https://pbs.twimg.com/profile_images/1752662263310213121/-7WSkFg2_normal.jpg",false,true,"11/30/2009, 2:07:10 PM","12/23/2023, 7:50:40 PM"
"1738491094848114834","thapagk","Gagan Thapa","Gagan","Thapa","कोशी विराटनगरमा .. https://t.co/HTifCN87ZL","12442",0,141,8,6,1,false,false,false,"","",false,"ne","Nepal","Member , House of Representatives (Kathmandu-4),  General Secretary, Nepali Congress. 🇳🇵","http://gaganthapa.com.np","http://gaganthapa.com.np",1292512,1248,1031,3738,6369,372,0,1292512,,,false,false,"https://pbs.twimg.com/profile_banners/93589182/1706327764","https://www.twitter.com/thapagk","https://pbs.twimg.com/profile_images/1752662263310213121/-7WSkFg2_normal.jpg",false,true,"11/30/2009, 2:07:10 PM","12/23/2023, 3:10:51 PM"
"1738376002961821988","thapagk","Gagan Thapa","Gagan","Thapa","नेपाली कांग्रेस उदयपुर - प्रथम जिल्ला सम्मेलन https://t.co/8OjVVZg2pR","12588",0,154,14,7,1,false,false,false,"","",false,"ne","Nepal","Member , House of Representatives (Kathmandu-4),  General Secretary, Nepali Congress. 🇳🇵","http://gaganthapa.com.np","http://gaganthapa.com.np",1292512,1248,1031,3738,6369,372,0,1292512,,,false,false,"https://pbs.twimg.com/profile_banners/93589182/1706327764","https://www.twitter.com/thapagk","https://pbs.twimg.com/profile_images/1752662263310213121/-7WSkFg2_normal.jpg",false,true,"11/30/2009, 2:07:10 PM","12/23/2023, 7:33:31 AM"
"1738188311909523692","thapagk","Gagan Thapa","Gagan","Thapa","नेपाली कांग्रेस प्रथम मधेस प्रदेश सम्मेलन, जनकपुरधाम https://t.co/3VQ340gN0S","16154",0,214,19,15,1,false,false,false,"","",false,"ne","Nepal","Member , House of Representatives (Kathmandu-4),  General Secretary, Nepali Congress. 🇳🇵","http://gaganthapa.com.np","http://gaganthapa.com.np",1292512,1248,1031,3738,6369,372,0,1292512,,,false,false,"https://pbs.twimg.com/profile_banners/93589182/1706327764","https://www.twitter.com/thapagk","https://pbs.twimg.com/profile_images/1752662263310213121/-7WSkFg2_normal.jpg",false,true,"11/30/2009, 2:07:10 PM","12/22/2023, 7:07:42 PM"
"1738167207883063296","thapagk","Gagan Thapa","Gagan","Thapa","प्रिय विश्व दाई जन्मदिनको सप्रेम शुभकामना! https://t.co/I49W32D6fs","52928",0,740,115,14,16,false,false,false,"","",false,"hi","Nepal","Member , House of Representatives (Kathmandu-4),  General Secretary, Nepali Congress. 🇳🇵","http://gaganthapa.com.np","http://gaganthapa.com.np",1292512,1248,1031,3738,6369,372,0,1292512,,,false,false,"https://pbs.twimg.com/profile_banners/93589182/1706327764","https://www.twitter.com/thapagk","https://pbs.twimg.com/profile_images/1752662263310213121/-7WSkFg2_normal.jpg",false,true,"11/30/2009, 2:07:10 PM","12/22/2023, 5:43:50 PM"
"1738103579200942196","thapagk","Gagan Thapa","Gagan","Thapa","नेपाली कांग्रेस प्रथम गण्डकी प्रदेश सम्मेलन, पोखरा https://t.co/gg5jdEQoq5","9110",0,146,6,13,3,false,false,false,"","",false,"ne","Nepal","Member , House of Representatives (Kathmandu-4),  General Secretary, Nepali Congress. 🇳🇵","http://gaganthapa.com.np","http://gaganthapa.com.np",1292512,1248,1031,3738,6369,372,0,1292512,,,false,false,"https://pbs.twimg.com/profile_banners/93589182/1706327764","https://www.twitter.com/thapagk","https://pbs.twimg.com/profile_images/1752662263310213121/-7WSkFg2_normal.jpg",false,true,"11/30/2009, 2:07:10 PM","12/22/2023, 1:31:00 PM"
"1738076815758143760","thapagk","Gagan Thapa","Gagan","Thapa","प्रजातन्त्र सेनानी एवं नेपाली कांग्रेसका संस्थापक सदस्य श्री रामनारायण मिश्रजीको ५६औँ पुण्य तिथिको अवसरमा गंगासागर, जनकपुरधाममा आयोजित श्रद्धाञ्जली एवं प्राथना सभा। https://t.co/5oLD4nEVER","17349",0,188,18,10,5,false,false,false,"","",false,"ne","Nepal","Member , House of Representatives (Kathmandu-4),  General Secretary, Nepali Congress. 🇳🇵","http://gaganthapa.com.np","http://gaganthapa.com.np",1292512,1248,1031,3738,6369,372,0,1292512,,,false,false,"https://pbs.twimg.com/profile_banners/93589182/1706327764","https://www.twitter.com/thapagk","https://pbs.twimg.com/profile_images/1752662263310213121/-7WSkFg2_normal.jpg",false,true,"11/30/2009, 2:07:10 PM","12/22/2023, 11:44:39 AM"
"1737761175541264628","thapagk","Gagan Thapa","Gagan","Thapa","तनहुँ https://t.co/ASsfHNa5cE","16930",0,220,106,11,3,false,false,false,"","",false,"hi","Nepal","Member , House of Representatives (Kathmandu-4),  General Secretary, Nepali Congress. 🇳🇵","http://gaganthapa.com.np","http://gaganthapa.com.np",1292512,1248,1031,3738,6369,372,0,1292512,,,false,false,"https://pbs.twimg.com/profile_banners/93589182/1706327764","https://www.twitter.com/thapagk","https://pbs.twimg.com/profile_images/1752662263310213121/-7WSkFg2_normal.jpg",false,true,"11/30/2009, 2:07:10 PM","12/21/2023, 2:50:24 PM"
"1737462190339453011","thapagk","Gagan Thapa","Gagan","Thapa","कुश्मा, पर्वतमा .. https://t.co/6gwhw0sLyr","15829",0,243,16,13,2,false,false,false,"","",false,"ne","Nepal","Member , House of Representatives (Kathmandu-4),  General Secretary, Nepali Congress. 🇳🇵","http://gaganthapa.com.np","http://gaganthapa.com.np",1292512,1248,1031,3738,6369,372,0,1292512,,,false,false,"https://pbs.twimg.com/profile_banners/93589182/1706327764","https://www.twitter.com/thapagk","https://pbs.twimg.com/profile_images/1752662263310213121/-7WSkFg2_normal.jpg",false,true,"11/30/2009, 2:07:10 PM","12/20/2023, 7:02:21 PM"
"1737290429207543959","thapagk","Gagan Thapa","Gagan","Thapa","पाल्पा जिल्ला सम्मेलनका क्रममा भएको लापरवाही प्रति क्षमा चाहान्छु, ‘Sorry’!

सम्मेलनको लागि नगरपालिकाको तल्लो तलामा रहेको हल भाडामा लिएर त्यसमा नै मूल ब्यानर टाँगेर कार्यक्रम सुरु भएको थियो तर हल बाहिर रहनुभएका साथीहरूले पनि मेरो कुरा सुन्न पाउनु पर्‍यो भनेर माग गरेपछि, मन्तव्यको…","67960",2,491,60,44,25,false,false,false,"","",false,"ne","Nepal","Member , House of Representatives (Kathmandu-4),  General Secretary, Nepali Congress. 🇳🇵","http://gaganthapa.com.np","http://gaganthapa.com.np",1292512,1248,1031,3738,6369,372,0,1292512,,,false,false,"https://pbs.twimg.com/profile_banners/93589182/1706327764","https://www.twitter.com/thapagk","https://pbs.twimg.com/profile_images/1752662263310213121/-7WSkFg2_normal.jpg",false,true,"11/30/2009, 2:07:10 PM","12/20/2023, 7:39:50 AM"
"1736742136417255663","thapagk","Gagan Thapa","Gagan","Thapa","पाल्पामा दुई दिन .. https://t.co/IwRnwjtBu4","16535",0,278,26,15,2,false,false,false,"","",false,"ne","Nepal","Member , House of Representatives (Kathmandu-4),  General Secretary, Nepali Congress. 🇳🇵","http://gaganthapa.com.np","http://gaganthapa.com.np",1292512,1248,1031,3738,6369,372,0,1292512,,,false,false,"https://pbs.twimg.com/profile_banners/93589182/1706327764","https://www.twitter.com/thapagk","https://pbs.twimg.com/profile_images/1752662263310213121/-7WSkFg2_normal.jpg",false,true,"11/30/2009, 2:07:10 PM","12/18/2023, 7:21:07 PM"
"1736320256438915209","thapagk","Gagan Thapa","Gagan","Thapa","माता जानकीक भगवान श्रीरामक संग संपन्न शुभ विवाहक स्मृतिमे प्रतिवर्ष राजर्षि जनकक पुण्यभूमिमे मनाओल साँस्कृतिक पावनि विवाह पञ्‍चमी पावन अवसर‌पर समस्त नेपाली‌के हार्दिक शुभकामना व्यक्त करैत छी। https://t.co/3h5U5H3tCM","16493",1,270,12,11,1,false,false,false,"","",false,"ne","Nepal","Member , House of Representatives (Kathmandu-4),  General Secretary, Nepali Congress. 🇳🇵","http://gaganthapa.com.np","http://gaganthapa.com.np",1292512,1248,1031,3738,6369,372,0,1292512,,,false,false,"https://pbs.twimg.com/profile_banners/93589182/1706327764","https://www.twitter.com/thapagk","https://pbs.twimg.com/profile_images/1752662263310213121/-7WSkFg2_normal.jpg",false,true,"11/30/2009, 2:07:10 PM","12/17/2023, 3:24:43 PM"
"1735849788602745081","thapagk","Gagan Thapa","Gagan","Thapa","सरकारले उपयुक्त अध्ययन बिना दीर्घकालीन महत्वका निर्णय लिनु भनेको पनि कुशासन हो। यस्तै भएको छ, नयाँ स्टक एक्सचेन्जको अनुमति दिने प्रक्रियामा! कुनै बेला सरकार आफैले रोकेको स्टक एक्सचेन्जको अनुमति बाँड्ने निर्णय पुनः अर्को अध्ययन नगरी अगाडि बढाउन लागेको खबरहरू आएका छन। पुँजी बजारको… https://t.co/rqhPiFz6AM","69793",1,537,127,60,14,false,false,false,"","",false,"ne","Nepal","Member , House of Representatives (Kathmandu-4),  General Secretary, Nepali Congress. 🇳🇵","http://gaganthapa.com.np","http://gaganthapa.com.np",1292512,1248,1031,3738,6369,372,0,1292512,,,false,false,"https://pbs.twimg.com/profile_banners/93589182/1706327764","https://www.twitter.com/thapagk","https://pbs.twimg.com/profile_images/1752662263310213121/-7WSkFg2_normal.jpg",false,true,"11/30/2009, 2:07:10 PM","12/16/2023, 8:15:14 AM"
"1734936923339407757","thapagk","Gagan Thapa","Gagan","Thapa","हाम्रो उच्च शिक्षा अस्त-व्यस्त छ। त्यसको प्रमुख कारण हो शिक्षामा भएको दलियकरण र विश्वविद्यालय नियुक्तिमा भएको भागबन्डा हो। यसमा हामी सबै उत्तिकै दोषी छौँ। तर यसलाई अब सच्चाउन पर्छ। उच्च शिक्षा सुधार र हाम्रा गल्ती सच्चाउने कुराको प्रस्थान बिन्दु हुन सक्छ देशकै जेठो र ठुलो… https://t.co/FaOLIVbW36","100507",5,662,205,105,71,false,false,false,"","",false,"ne","Nepal","Member , House of Representatives (Kathmandu-4),  General Secretary, Nepali Congress. 🇳🇵","http://gaganthapa.com.np","http://gaganthapa.com.np",1292512,1248,1031,3738,6369,372,0,1292512,,,false,false,"https://pbs.twimg.com/profile_banners/93589182/1706327764","https://www.twitter.com/thapagk","https://pbs.twimg.com/profile_images/1752662263310213121/-7WSkFg2_normal.jpg",false,true,"11/30/2009, 2:07:10 PM","12/13/2023, 7:47:50 PM"
"1733126126976049330","thapagk","Gagan Thapa","Gagan","Thapa","जाजरकोटमा झनै चिसो बढेको छ

अस्थायी आवास निर्माणका लागि भूकम्प प्रभावित क्षेत्रमा पुग्नु भएका केही साथीहरू अस्थायी टहराहरू निर्माण गरेर फर्कनु भएको छ।  केही साथीहरू अहिले प्रभावित क्षेत्रमा निरन्तर काम गरी राख्नु भएको छ।  

हामीले मङ्सिर २६ बाट पुस ६ गते सम्म अस्थायी आवास… https://t.co/A95QPUESaK","19289",0,250,17,33,4,false,false,false,"","",false,"ne","Nepal","Member , House of Representatives (Kathmandu-4),  General Secretary, Nepali Congress. 🇳🇵","http://gaganthapa.com.np","http://gaganthapa.com.np",1292512,1248,1031,3738,6369,372,0,1292512,,,false,false,"https://pbs.twimg.com/profile_banners/93589182/1706327764","https://www.twitter.com/thapagk","https://pbs.twimg.com/profile_images/1752662263310213121/-7WSkFg2_normal.jpg",false,true,"11/30/2009, 2:07:10 PM","12/8/2023, 7:52:23 PM"
"1732722451489190171","thapagk","Gagan Thapa","Gagan","Thapa","एनसेल प्रकरण: समिति बन्यो ठिक हुन्छ भन्ने अवस्था छैन,सशक्त खबरदारी आवश्यक छ

एनसेलको खरिदबिक्रीसँग जोडिएर सार्वजनिक भएका विषय हेर्दा प्रथम दृष्टिमा नै यो प्रकरणमा ठुलो अनियमितता भएको सहजै अनुमान लगाउन सकिन्छ।

तत्कालै यो प्रकरणमा विभिन्न तहबाट प्रश्न उठेकै छन्।संसदीय…","48757",0,296,82,45,20,false,false,false,"","",false,"ne","Nepal","Member , House of Representatives (Kathmandu-4),  General Secretary, Nepali Congress. 🇳🇵","http://gaganthapa.com.np","http://gaganthapa.com.np",1292512,1248,1031,3738,6369,372,0,1292512,,,false,false,"https://pbs.twimg.com/profile_banners/93589182/1706327764","https://www.twitter.com/thapagk","https://pbs.twimg.com/profile_images/1752662263310213121/-7WSkFg2_normal.jpg",false,true,"11/30/2009, 2:07:10 PM","12/7/2023, 5:08:19 PM"
"1732353733655437734","thapagk","Gagan Thapa","Gagan","Thapa","रुकुम पश्चिम सोती गाउँमा सङ्गठित र योजनाबद्ध रूपमा भएको नवराज विकसहित ६ युवाको हत्याका सन्दर्भमा अदालतले गरेको फैसला ऐतिहासिक छ। 

यो फैसलाले जातीय विभेद र छुवाछुतको आडमा हुने अपराधका विरुद्धमा हाम्रो न्याय प्रणाली सशक्त रूपमा उभिएको छ र नेपालको न्यायिक इतिहासमा यो फैसलाले एउटा…","25425",1,311,16,45,6,false,false,false,"","",false,"ne","Nepal","Member , House of Representatives (Kathmandu-4),  General Secretary, Nepali Congress. 🇳🇵","http://gaganthapa.com.np","http://gaganthapa.com.np",1292512,1248,1031,3738,6369,372,0,1292512,,,false,false,"https://pbs.twimg.com/profile_banners/93589182/1706327764","https://www.twitter.com/thapagk","https://pbs.twimg.com/profile_images/1752662263310213121/-7WSkFg2_normal.jpg",false,true,"11/30/2009, 2:07:10 PM","12/6/2023, 4:43:10 PM"
"1731292391787876676","thapagk","Gagan Thapa","Gagan","Thapa","समुन्नत नेपाल, सम्मानित नेपाली' बनाउने हाम्रो सपनाको सबैभन्दा महत्त्वपूर्ण विषय हरेक नागरिकलाई समान अवसर हो। हामीले कोही पनि व्यक्ति अपाङ्ग भएकै कारण त्यो अवसर बाट वञ्चित हुनुपर्ने अवस्थाको अन्त्य गर्नुपर्ने छ। समतामुलक कानुनको निर्माण गरी अपाङ्गता भएका व्यक्तिहरूलाई हरेक…","41525",2,298,68,24,8,false,false,false,"","",false,"ne","Nepal","Member , House of Representatives (Kathmandu-4),  General Secretary, Nepali Congress. 🇳🇵","http://gaganthapa.com.np","http://gaganthapa.com.np",1292512,1248,1031,3738,6369,372,0,1292512,,,false,false,"https://pbs.twimg.com/profile_banners/93589182/1706327764","https://www.twitter.com/thapagk","https://pbs.twimg.com/profile_images/1752662263310213121/-7WSkFg2_normal.jpg",false,true,"11/30/2009, 2:07:10 PM","12/3/2023, 6:25:46 PM"
