tweet_id,username,name,first_name,last_name,full_text,view_count,bookmark_count,favorite_count,reply_count,retweet_count,quote_count,bookmarked,favorited,retweeted,user_mentions,url_mentions,is_quote_status,lang,location,bio,website,websites,followers_count,following_count,media_count,statuses_count,favourites_count,listed_count,fast_followers_count,normal_followers_count,followed_by,following,can_dm,can_media_tag,profile_banner_url,profile_url,avatar_url,verified,is_blue_verified,user_created_at,created_at
1.77519E+18,sobita465,सोबिता गौतम,सोबिता,गौतम,"आज प्रतिनिधि सभामा प्रस्तुत विमिस्टेक वडा पत्र (BIMSTEC Charter) को अनुमोदन प्रस्तावमा मेरो टिप्पणी ।

१) एसियाली देशहरू आज विश्व अर्थतन्त्रकै प्रमुख शक्तिमा रूपान्तरण हुदै गर्दा परिवर्तनकारी समयलाई हामीले चिन्न र यसमा संलग्न भई आफ्नो क्षमता विकाश गर्न ढिला गर्नु हुदैन ।

२)सार्क… https://t.co/Oa6Cw0J9Sy",10524,1,247,96,26,3,FALSE,FALSE,FALSE,,,FALSE,ne,,"प्रतिनिधि सभा सदस्य(Member of Parliament) , Central Committee Member of Rastriya Swatantra Party",,,63664,368,153,597,885,10,0,63664,,,TRUE,TRUE,https://pbs.twimg.com/profile_banners/1231492321423716353/1683015976,https://www.twitter.com/sobita465,https://pbs.twimg.com/profile_images/1653314903531479046/xeJg-0VW_normal.jpg,FALSE,TRUE,"2/23/2020, 1:59:14 PM","4/2/2024, 9:41:49 PM"
1.77412E+18,sobita465,सोबिता गौतम,सोबिता,गौतम,"कानुन, न्याय तथा मानवअधिकार समितीबाट बाँके, बर्दीया र सु्र्खेतमा रहेका कारागार तथा बाल सुधार गृहरूमा न्यायप्रणालीका व्यबहारीक पक्ष, कैदी/बन्दीको अवस्था लगायतका विषयमा स्थलगत अनुगमन गरेका छौँ। समितीबाट प्रतिबेदन तयार गरी आवश्यक निती छिटो भन्दा छिटो अवलम्बन गर्न थप प्रयत्नशिल रहने… https://t.co/b2wJOPyNcm",5788,0,242,6,16,1,FALSE,FALSE,FALSE,,,FALSE,ne,,"प्रतिनिधि सभा सदस्य(Member of Parliament) , Central Committee Member of Rastriya Swatantra Party",,,63664,368,153,597,885,10,0,63664,,,TRUE,TRUE,https://pbs.twimg.com/profile_banners/1231492321423716353/1683015976,https://www.twitter.com/sobita465,https://pbs.twimg.com/profile_images/1653314903531479046/xeJg-0VW_normal.jpg,FALSE,TRUE,"2/23/2020, 1:59:14 PM","3/30/2024, 10:54:18 PM"
1.7717E+18,sobita465,सोबिता गौतम,सोबिता,गौतम,रंगहरूको पर्वसँगै तपाईको जीवनको हरेक अध्याय रंगिन र उज्यालो रहोस् ।शुभकामना । https://t.co/dePLxUnuPA,13117,0,553,41,15,2,FALSE,FALSE,FALSE,,,FALSE,ne,,"प्रतिनिधि सभा सदस्य(Member of Parliament) , Central Committee Member of Rastriya Swatantra Party",,,63664,368,153,597,885,10,0,63664,,,TRUE,TRUE,https://pbs.twimg.com/profile_banners/1231492321423716353/1683015976,https://www.twitter.com/sobita465,https://pbs.twimg.com/profile_images/1653314903531479046/xeJg-0VW_normal.jpg,FALSE,TRUE,"2/23/2020, 1:59:14 PM","3/24/2024, 6:42:59 AM"
1.77119E+18,sobita465,सोबिता गौतम,सोबिता,गौतम,युवाका लागि बहुआयामिक र दूरगामी फाइदा रहेका पार्ट-टाइम (अंशकालीन) काम नीति बनाउन र त्यसको कार्यान्वयन गर्न ढिला गर्न हुँदैन । यो अध्ययन र रोजगारीका लागि विदेशिने विशाल जमातलाई स्वदेशमै रोक्ने कामको पहिलो खुड्किलो बन्नेछ । https://t.co/0N7CHozLli https://t.co/1vIYPd4OAz,11034,1,328,24,29,6,FALSE,FALSE,FALSE,,https://www.onlinekhabar.com/2024/03/1452575,FALSE,ne,,"प्रतिनिधि सभा सदस्य(Member of Parliament) , Central Committee Member of Rastriya Swatantra Party",,,63664,368,153,597,885,10,0,63664,,,TRUE,TRUE,https://pbs.twimg.com/profile_banners/1231492321423716353/1683015976,https://www.twitter.com/sobita465,https://pbs.twimg.com/profile_images/1653314903531479046/xeJg-0VW_normal.jpg,FALSE,TRUE,"2/23/2020, 1:59:14 PM","3/22/2024, 8:38:50 PM"
1.77069E+18,sobita465,सोबिता गौतम,सोबिता,गौतम,"नेपालको बाल सुधार गृह र कारागार व्यवस्थापनबारे तपाइको कुनै सुझावहरू छन् भने तलको लिंकमा गइ सुझाव दिनुहुन अनुरोध छ । 

https://t.co/LrLKSfI564",5814,0,118,7,21,2,FALSE,FALSE,FALSE,,https://forms.gle/jVMKmdN88jo5h4d7A,FALSE,ne,,"प्रतिनिधि सभा सदस्य(Member of Parliament) , Central Committee Member of Rastriya Swatantra Party",,,63664,368,153,597,885,10,0,63664,,,TRUE,TRUE,https://pbs.twimg.com/profile_banners/1231492321423716353/1683015976,https://www.twitter.com/sobita465,https://pbs.twimg.com/profile_images/1653314903531479046/xeJg-0VW_normal.jpg,FALSE,TRUE,"2/23/2020, 1:59:14 PM","3/21/2024, 11:56:54 AM"
1.77008E+18,sobita465,सोबिता गौतम,सोबिता,गौतम,"भन्सार सम्बन्धी विधेयक २०८० मा मेरो टिप्पणी : 
1.Revised Kyoto Convention र WTO General Agreement on Tariff and Trade अनुसार विधेयक लिएर आएको र विधेयक स्वागतयोग्य छ ! 
2. प्रविधिको उच्चतम प्रयोग गरि भन्सार प्रक्रिया सहज र पारदर्शी हुनुपर्यो! भन्सार प्रशासन पारदर्शी भयो भने स्वत… https://t.co/TtZhovLqho",9403,3,282,5,33,2,FALSE,FALSE,FALSE,,,FALSE,ne,,"प्रतिनिधि सभा सदस्य(Member of Parliament) , Central Committee Member of Rastriya Swatantra Party",,,63664,368,153,597,885,10,0,63664,,,TRUE,TRUE,https://pbs.twimg.com/profile_banners/1231492321423716353/1683015976,https://www.twitter.com/sobita465,https://pbs.twimg.com/profile_images/1653314903531479046/xeJg-0VW_normal.jpg,FALSE,TRUE,"2/23/2020, 1:59:14 PM","3/19/2024, 7:07:58 PM"
1.76972E+18,sobita465,सोबिता गौतम,सोबिता,गौतम,"विनियोजन विधेयक, २०८० का सिद्धान्त र प्राथमिकता माथिको छलफलमा मेरो सुझाव
विनियोजन विधेयकमा प्राथमिकतामा राखिनुपर्ने विषय :
१. रोजगारी
निजी क्षेत्र र विदेशी लगानीको प्रवर्धनसँगै, Gig Economy Formalise गर्ने ।
२. दिगो विकास लक्षित विकास नीति
एकीकृत वस्तीको अवधारणा लागु गर्ने ।
३.… https://t.co/ZSopyW5f1G",12711,3,301,16,29,7,FALSE,FALSE,FALSE,,,FALSE,ne,,"प्रतिनिधि सभा सदस्य(Member of Parliament) , Central Committee Member of Rastriya Swatantra Party",,,63664,368,153,597,885,10,0,63664,,,TRUE,TRUE,https://pbs.twimg.com/profile_banners/1231492321423716353/1683015976,https://www.twitter.com/sobita465,https://pbs.twimg.com/profile_images/1653314903531479046/xeJg-0VW_normal.jpg,FALSE,TRUE,"2/23/2020, 1:59:14 PM","3/18/2024, 7:32:45 PM"
1.76824E+18,sobita465,सोबिता गौतम,सोबिता,गौतम,राष्ट्रिय निर्माण सामग्री व्यवस्थापन कम्पनी स्थापना गरौं  https://t.co/dN2n52Hpdn,11583,0,172,15,16,9,FALSE,FALSE,FALSE,,https://www.nepalviews.com/2024/03/14/257172/,FALSE,ne,,"प्रतिनिधि सभा सदस्य(Member of Parliament) , Central Committee Member of Rastriya Swatantra Party",,,63664,368,153,597,885,10,0,63664,,,TRUE,TRUE,https://pbs.twimg.com/profile_banners/1231492321423716353/1683015976,https://www.twitter.com/sobita465,https://pbs.twimg.com/profile_images/1653314903531479046/xeJg-0VW_normal.jpg,FALSE,TRUE,"2/23/2020, 1:59:14 PM","3/14/2024, 5:27:08 PM"
1.76824E+18,sobita465,सोबिता गौतम,सोबिता,गौतम,सरकारले किसानको घाउमा मलम लगाओस्   https://t.co/KCGtncSf7h,2266,0,49,2,4,1,FALSE,FALSE,FALSE,,https://www.onlinekhabar.com/2024/03/1448972,FALSE,ne,,"प्रतिनिधि सभा सदस्य(Member of Parliament) , Central Committee Member of Rastriya Swatantra Party",,,63664,368,153,597,885,10,0,63664,,,TRUE,TRUE,https://pbs.twimg.com/profile_banners/1231492321423716353/1683015976,https://www.twitter.com/sobita465,https://pbs.twimg.com/profile_images/1653314903531479046/xeJg-0VW_normal.jpg,FALSE,TRUE,"2/23/2020, 1:59:14 PM","3/14/2024, 5:26:12 PM"
1.76462E+18,sobita465,सोबिता गौतम,सोबिता,गौतम,राष्ट्रिय स्वतन्त्र पार्टीको उर्जा नीति मन्थनका केही झलकहरू । https://t.co/K01x0s4Del,12123,0,271,13,18,3,FALSE,FALSE,FALSE,,,FALSE,ne,,"प्रतिनिधि सभा सदस्य(Member of Parliament) , Central Committee Member of Rastriya Swatantra Party",,,63664,368,153,597,885,10,0,63664,,,TRUE,TRUE,https://pbs.twimg.com/profile_banners/1231492321423716353/1683015976,https://www.twitter.com/sobita465,https://pbs.twimg.com/profile_images/1653314903531479046/xeJg-0VW_normal.jpg,FALSE,TRUE,"2/23/2020, 1:59:14 PM","3/4/2024, 5:45:58 PM"
1.76349E+18,sobita465,सोबिता गौतम,सोबिता,गौतम,"सशस्त्र द्वन्द्वको बेला मानिसहरू गाउँ–गाउँबाट सुरक्षा खोज्न, ज्यान जोगाउन काठमाडौंमा स्थानान्तरित भए। काठमाडौंमा अनपेक्षित रूपमा जनसंख्या बढ्यो। रोजीरोटीका आवसरहरू खोजिन थालिए। त्यही बेलादेखि फुटपाथमा सामान राखेर व्यापार गर्ने क्रम बढ्न सुरू भएको देखिन्छ। अहिले पनि नेपालभरबाट…",67605,8,413,100,36,21,FALSE,FALSE,FALSE,,,FALSE,ne,,"प्रतिनिधि सभा सदस्य(Member of Parliament) , Central Committee Member of Rastriya Swatantra Party",,,63664,368,153,597,885,10,0,63664,,,TRUE,TRUE,https://pbs.twimg.com/profile_banners/1231492321423716353/1683015976,https://www.twitter.com/sobita465,https://pbs.twimg.com/profile_images/1653314903531479046/xeJg-0VW_normal.jpg,FALSE,TRUE,"2/23/2020, 1:59:14 PM","3/1/2024, 2:41:17 PM"
1.76209E+18,sobita465,सोबिता गौतम,सोबिता,गौतम,"हजार सपनाहरूको माया लागेर आउँछ …..

वरिष्ठ गायक तथा संगीतकार, भजन शिरोमणी भक्तराज आचार्य प्रती भावपुर्ण श्रद्धान्जली । https://t.co/Y0eIZGFXzG",5782,0,176,4,17,1,FALSE,FALSE,FALSE,,,FALSE,ne,,"प्रतिनिधि सभा सदस्य(Member of Parliament) , Central Committee Member of Rastriya Swatantra Party",,,63664,368,153,597,885,10,0,63664,,,TRUE,TRUE,https://pbs.twimg.com/profile_banners/1231492321423716353/1683015976,https://www.twitter.com/sobita465,https://pbs.twimg.com/profile_images/1653314903531479046/xeJg-0VW_normal.jpg,FALSE,TRUE,"2/23/2020, 1:59:14 PM","2/26/2024, 6:07:26 PM"
1.76164E+18,sobita465,सोबिता गौतम,सोबिता,गौतम,काठमाडौँ क्षेत्र नं २ अन्तर्गत पर्ने शंखरापुर नगरपालिका वडा नं. १ नाग्लेभारेमा रहेको साखु–फट्केश्वर सडक भासिएको ६ महिना भन्दा बढी समय भयो । आज शून्य समयमा सम्माननीय सभामुख मार्फत सरकारलाई खबरदारी गरेको छु । https://t.co/874fLInAWi,11043,1,313,7,25,1,FALSE,FALSE,FALSE,,,FALSE,ne,,"प्रतिनिधि सभा सदस्य(Member of Parliament) , Central Committee Member of Rastriya Swatantra Party",,,63664,368,153,597,885,10,0,63664,,,TRUE,TRUE,https://pbs.twimg.com/profile_banners/1231492321423716353/1683015976,https://www.twitter.com/sobita465,https://pbs.twimg.com/profile_images/1653314903531479046/xeJg-0VW_normal.jpg,FALSE,TRUE,"2/23/2020, 1:59:14 PM","2/25/2024, 12:14:59 PM"
1.75871E+18,sobita465,सोबिता गौतम,सोबिता,गौतम,"आत्तु (नमस्ते) 
फागुन ५ गते (आज) देखि ७ गतेसम्म कर्णाली प्रदेशको राजधानी सुर्खेतको वीरेन्द्रनगर स्थित बुलबुले उद्यानमा हुन गइरहेको कर्णाली उत्सव ..कुडा कर्नालीकाको पाँचौं संस्करण सभ्य र भव्य रुपमा सफल बनोस् ! उत्सवका साथीका रुपमा कर्णाली उत्सवलाई सफलताको शुभकामना !

कर्नालीका… https://t.co/JoH1cMSHwe",8818,0,256,5,24,0,FALSE,FALSE,FALSE,,,FALSE,ne,,"प्रतिनिधि सभा सदस्य(Member of Parliament) , Central Committee Member of Rastriya Swatantra Party",,,63664,368,153,597,885,10,0,63664,,,TRUE,TRUE,https://pbs.twimg.com/profile_banners/1231492321423716353/1683015976,https://www.twitter.com/sobita465,https://pbs.twimg.com/profile_images/1653314903531479046/xeJg-0VW_normal.jpg,FALSE,TRUE,"2/23/2020, 1:59:14 PM","2/17/2024, 10:13:27 AM"
1.7549E+18,sobita465,सोबिता गौतम,सोबिता,गौतम,"आज साँझ काठमाडौं क्षेत्र नं २ अन्तर्गत भेटघाटका क्रममा नेपालको प्रजातान्त्रिक इतिहासका अग्रणी व्यक्तित्व, पूर्वसभामुख दमननाथ ढुंगानासँग संसदीय अभ्यास तथा समसामयिक राजनैतिक विषयमा छलफल ।
@daman_nath https://t.co/YMxbPYbSfN",9912,0,327,5,13,0,FALSE,FALSE,FALSE,daman_nath,,FALSE,ne,,"प्रतिनिधि सभा सदस्य(Member of Parliament) , Central Committee Member of Rastriya Swatantra Party",,,63664,368,153,597,885,10,0,63664,,,TRUE,TRUE,https://pbs.twimg.com/profile_banners/1231492321423716353/1683015976,https://www.twitter.com/sobita465,https://pbs.twimg.com/profile_images/1653314903531479046/xeJg-0VW_normal.jpg,FALSE,TRUE,"2/23/2020, 1:59:14 PM","2/6/2024, 9:43:40 PM"
1.75474E+18,sobita465,सोबिता गौतम,सोबिता,गौतम,"मैले पटक-पटक संसदको रोस्टममा उभिएर आउँदो अधिवेशनमा प्रस्तुत हुने विधेयकको सूची उपलब्ध गराउन सरकारसँग माग गरेकी छु । माननीय @SumanaShrestha  ले संसदीय तालिका माग गर्नुभएको छ । माग गरिएका कार्यसूची र तालिका दुबै आएका छन् । 

सम्पूर्ण अधिवेशनकै कार्यसूची माग गरेकोमा मासिक सम्भावित… https://t.co/zswosW6hjr",31542,1,291,11,31,5,FALSE,FALSE,FALSE,SumanaShrestha,,FALSE,ne,,"प्रतिनिधि सभा सदस्य(Member of Parliament) , Central Committee Member of Rastriya Swatantra Party",,,63664,368,153,597,885,10,0,63664,,,TRUE,TRUE,https://pbs.twimg.com/profile_banners/1231492321423716353/1683015976,https://www.twitter.com/sobita465,https://pbs.twimg.com/profile_images/1653314903531479046/xeJg-0VW_normal.jpg,FALSE,TRUE,"2/23/2020, 1:59:14 PM","2/6/2024, 11:32:11 AM"
1.75436E+18,sobita465,सोबिता गौतम,सोबिता,गौतम,"न्यायलयको आन्तरिक तथा न्यायीक विषयमा संघीय  सांसदको हैसियतले मैले बोल्न मिल्दै भन्ने कुरामा म सचेत छु ! तर, प्रशासनिक निर्णयले वा अधिनस्थ विधायनले न्यायलयको स्वतन्त्रता, न्यायाधीशको व्यक्तिगत स्वतन्त्रता  (individual independency) र गरिमा खोस्ने विषय संविधान अनुकुल हुन सक्दैन।…",13305,0,162,9,15,3,FALSE,FALSE,FALSE,,,FALSE,ne,,"प्रतिनिधि सभा सदस्य(Member of Parliament) , Central Committee Member of Rastriya Swatantra Party",,,63664,368,153,597,885,10,0,63664,,,TRUE,TRUE,https://pbs.twimg.com/profile_banners/1231492321423716353/1683015976,https://www.twitter.com/sobita465,https://pbs.twimg.com/profile_images/1653314903531479046/xeJg-0VW_normal.jpg,FALSE,TRUE,"2/23/2020, 1:59:14 PM","2/5/2024, 10:12:05 AM"
1.74617E+18,sobita465,सोबिता गौतम,सोबिता,गौतम,उच्च अदालतका न्यायाधीशको वरियतालाई संविधानको धारा १४१ को ३ को प्रतिकुल हुने गरेर संशोधन गरिएको छ। ऐनले दिएको अधिकार दुरूपयोग गरेर नियमावली संशोधन भएको छ,10157,0,113,3,13,0,FALSE,FALSE,FALSE,,,TRUE,ne,,"प्रतिनिधि सभा सदस्य(Member of Parliament) , Central Committee Member of Rastriya Swatantra Party",,,63664,368,153,597,885,10,0,63664,,,TRUE,TRUE,https://pbs.twimg.com/profile_banners/1231492321423716353/1683015976,https://www.twitter.com/sobita465,https://pbs.twimg.com/profile_images/1653314903531479046/xeJg-0VW_normal.jpg,FALSE,TRUE,"2/23/2020, 1:59:14 PM","1/13/2024, 7:26:34 PM"
1.73854E+18,sobita465,सोबिता गौतम,सोबिता,गौतम,‘सोबितासँग संवाद’ को चौथो संवाद काठमाडौँ क्षेत्र नं. २ अन्तर्गत पर्ने काठमाडौँ महानगरपालिका वडा नं. ३२ पेप्सिकोलाको सूर्यमुखी गार्डेनमा । https://t.co/MsN9BS7mol,8964,0,251,6,12,0,FALSE,FALSE,FALSE,,,FALSE,ne,,"प्रतिनिधि सभा सदस्य(Member of Parliament) , Central Committee Member of Rastriya Swatantra Party",,,63664,368,153,597,885,10,0,63664,,,TRUE,TRUE,https://pbs.twimg.com/profile_banners/1231492321423716353/1683015976,https://www.twitter.com/sobita465,https://pbs.twimg.com/profile_images/1653314903531479046/xeJg-0VW_normal.jpg,FALSE,TRUE,"2/23/2020, 1:59:14 PM","12/23/2023, 6:23:13 PM"
1.73711E+18,sobita465,सोबिता गौतम,सोबिता,गौतम,राम्रो कामलाई राम्रो भन्छु । प्राधिकरणको मुख्य जिम्मेवारी नियमनकारी हुनु नै हो । हवाई सेवासँग सम्बन्धित सबै क्षेत्र कसिलो गरी नियमन हुनुपर्छ ।,13009,1,142,11,12,1,FALSE,FALSE,FALSE,,,TRUE,ne,,"प्रतिनिधि सभा सदस्य(Member of Parliament) , Central Committee Member of Rastriya Swatantra Party",,,63664,368,153,597,885,10,0,63664,,,TRUE,TRUE,https://pbs.twimg.com/profile_banners/1231492321423716353/1683015976,https://www.twitter.com/sobita465,https://pbs.twimg.com/profile_images/1653314903531479046/xeJg-0VW_normal.jpg,FALSE,TRUE,"2/23/2020, 1:59:14 PM","12/19/2023, 7:54:59 PM"
1.73515E+18,sobita465,सोबिता गौतम,सोबिता,गौतम,"नेपाल एयरलाइन्सको ग्राउन्ड ह्यान्डिलिङ, नेपालको हवाई क्षेत्र यूरोपिएन यूनिएनको कालो सुचिमा यथावत रहको बारे र नेपाल एरलाइन्सको नयाँ जहाज खरिद बारे राष्ट्रिय स्वतन्त्र पार्टीको स्पष्ट धारणा सहित सम्माननिय प्रधानमन्त्री समक्ष ध्यानाकर्षण पत्र बुझाएका छौँ । https://t.co/hlpGdbvkRk",15655,1,287,10,31,7,FALSE,FALSE,FALSE,,,FALSE,ne,,"प्रतिनिधि सभा सदस्य(Member of Parliament) , Central Committee Member of Rastriya Swatantra Party",,,63664,368,153,597,885,10,0,63664,,,TRUE,TRUE,https://pbs.twimg.com/profile_banners/1231492321423716353/1683015976,https://www.twitter.com/sobita465,https://pbs.twimg.com/profile_images/1653314903531479046/xeJg-0VW_normal.jpg,FALSE,TRUE,"2/23/2020, 1:59:14 PM","12/14/2023, 9:52:20 AM"
1.73492E+18,sobita465,सोबिता गौतम,सोबिता,गौतम,"संविधान जारी भएको ८ वर्ष भइ सक्दा पनि यौनिक तथा लैङ्गिक अल्पसंख्यकको विवाह, सम्बन्ध विच्छेद, सम्पत्ति तथा बच्चासम्बन्धी अधिकारलगायत ऐन तथा कानूनको निर्माण हुन सकेको छैन । तत् कानून निर्माणको लागि छलफलको माग गर्दै कानुन, न्याय तथा मानव अधिकार समितिका सभापतिज्यू समक्ष पत्र प्रेषित… https://t.co/tb31s43NJC",12988,0,199,14,28,3,FALSE,FALSE,FALSE,,,FALSE,ne,,"प्रतिनिधि सभा सदस्य(Member of Parliament) , Central Committee Member of Rastriya Swatantra Party",,,63664,368,153,597,885,10,0,63664,,,TRUE,TRUE,https://pbs.twimg.com/profile_banners/1231492321423716353/1683015976,https://www.twitter.com/sobita465,https://pbs.twimg.com/profile_images/1653314903531479046/xeJg-0VW_normal.jpg,FALSE,TRUE,"2/23/2020, 1:59:14 PM","12/13/2023, 6:57:47 PM"
1.7299E+18,sobita465,सोबिता गौतम,सोबिता,गौतम,सबै साथीहरूलाई बधाई। 🔔 https://t.co/AzNkITjYtu,47415,0,698,95,29,6,FALSE,FALSE,FALSE,,,FALSE,ne,,"प्रतिनिधि सभा सदस्य(Member of Parliament) , Central Committee Member of Rastriya Swatantra Party",,,63664,368,153,597,885,10,0,63664,,,TRUE,TRUE,https://pbs.twimg.com/profile_banners/1231492321423716353/1683015976,https://www.twitter.com/sobita465,https://pbs.twimg.com/profile_images/1653314903531479046/xeJg-0VW_normal.jpg,FALSE,TRUE,"2/23/2020, 1:59:14 PM","11/29/2023, 10:17:24 PM"
