tweet_id,username,name,first_name,last_name,full_text,view_count,bookmark_count,favorite_count,reply_count,retweet_count,quote_count,bookmarked,favorited,retweeted,user_mentions,url_mentions,is_quote_status,lang,location,bio,website,websites,followers_count,following_count,media_count,statuses_count,favourites_count,listed_count,fast_followers_count,normal_followers_count,followed_by,following,can_dm,can_media_tag,profile_banner_url,profile_url,avatar_url,verified,is_blue_verified,user_created_at,created_at
1.65983E+18,SumanaShrestha,Sumana,Sumana,,"खबर पुगोस् तर केही गर्न नभ्याओस् भन्ने नियतले प्रकृया बनाएको हैन त यो?

1/2 https://t.co/BRHrXPTOT5",61645,2,811,24,121,17,FALSE,FALSE,FALSE,,,FALSE,ne,Nepal,"Minister, Ministry of Education, Science and Technology | @Moest_Nepal 🇳🇵| 📧: secretariat.minister@moest.gov.np",https://sumanashrestha.com.np/,https://sumanashrestha.com.np/,31675,157,373,919,192,13,0,31675,,,,,https://pbs.twimg.com/profile_banners/547853894/1674226811,https://www.twitter.com/SumanaShrestha,https://pbs.twimg.com/profile_images/616529424876306432/xIOqRt9z_normal.png,FALSE,FALSE,"4/8/2012, 1:20:11 AM","5/20/2023, 1:31:42 PM"
1.64283E+18,SumanaShrestha,Sumana,Sumana,,"सभामुख मार्फत सबै सांसदहरूलाई मेरो प्रश्नः तपाईँहरू कै पार्टीका मेयर छन्, उप-मेयर छन्; प्रदेश सरकारमा यहाँहरू कै प्रतिनिधिहरू हुनुहुन्छ। कुन कानून नभएकाले चाँही मिटरब्याजीका पीडितहरुलाई न्याय दिन नसकेको हो? https://t.co/4ygCk87OZr",48919,2,815,32,133,16,FALSE,FALSE,FALSE,,,FALSE,ne,Nepal,"Minister, Ministry of Education, Science and Technology | @Moest_Nepal 🇳🇵| 📧: secretariat.minister@moest.gov.np",https://sumanashrestha.com.np/,https://sumanashrestha.com.np/,31675,157,373,919,192,13,0,31675,,,,,https://pbs.twimg.com/profile_banners/547853894/1674226811,https://www.twitter.com/SumanaShrestha,https://pbs.twimg.com/profile_images/616529424876306432/xIOqRt9z_normal.png,FALSE,FALSE,"4/8/2012, 1:20:11 AM","4/3/2023, 4:07:30 PM"
1.75521E+18,SumanaShrestha,Sumana,Sumana,,"सम्पत्ति शुद्धिकरण 'निवारण' सम्बन्धी विधेयक भन्दा पनि सम्पत्ति शुद्धिकरण 'प्रवर्द्धन' विधेयक भने पनि हुन्छ। 

विधेयकको दफा ११ (मूल ऐनको दफा २८को संशोधन) हेर्ने हो भने यहाहरु सबैलाई स्पष्ट हुन्छ यो विधेयक भ्रष्टाचारीहरुलाई प्रशय दिन ल्याईएको हो । अझ भ्रष्टाचारीको राज चलाउन कानुन… https://t.co/Lbg9MPLusR",39300,15,818,40,184,24,FALSE,FALSE,FALSE,,,FALSE,ne,Nepal,"Minister, Ministry of Education, Science and Technology | @Moest_Nepal 🇳🇵| 📧: secretariat.minister@moest.gov.np",https://sumanashrestha.com.np/,https://sumanashrestha.com.np/,31675,157,373,919,192,13,0,31675,,,,,https://pbs.twimg.com/profile_banners/547853894/1674226811,https://www.twitter.com/SumanaShrestha,https://pbs.twimg.com/profile_images/616529424876306432/xIOqRt9z_normal.png,FALSE,FALSE,"4/8/2012, 1:20:11 AM","2/7/2024, 6:40:34 PM"
1.69645E+18,SumanaShrestha,Sumana,Sumana,,३ मिनेटमा ८१ वटा ऐन संशोधन गर्ने बनेको विधेयकमा सैद्धान्तिक छलफल के कर्मकाण्डी मात्रै भएन र? त्यस पछि ७२ घण्टा संशोधनका लागि। विश्वासघात गरिँदै छ जनताको मतलाई; विश्वासघात गरिँदै छ देशका महत्वपूर्ण मुद्दाहरु माथि - रबर स्ट्याम्प बनाईँदैछ सदनलाई। https://t.co/xJNrAFM9RN,40932,1,800,28,171,15,FALSE,FALSE,FALSE,,,FALSE,ne,Nepal,"Minister, Ministry of Education, Science and Technology | @Moest_Nepal 🇳🇵| 📧: secretariat.minister@moest.gov.np",https://sumanashrestha.com.np/,https://sumanashrestha.com.np/,31675,157,373,919,192,13,0,31675,,,,,https://pbs.twimg.com/profile_banners/547853894/1674226811,https://www.twitter.com/SumanaShrestha,https://pbs.twimg.com/profile_images/616529424876306432/xIOqRt9z_normal.png,FALSE,FALSE,"4/8/2012, 1:20:11 AM","8/29/2023, 3:03:54 PM"
1.68149E+18,SumanaShrestha,Sumana,Sumana,,"यदी तपाईँ फेसबुक, इन्स्टाग्राम, टिकटकका माध्यमबाट आफ्नो सामान बेच्नुहुन्छ, कुनै सरसुविधा प्रदान गर्नुहुन्छ, वा कुनै कन्टेन्ट बनाएर आमदानी गर्नुहुन्छ र यो विद्युतीय व्यापार सम्बन्धी विधेयकमा आफ्ना राय राख्न चाहनुहुन्छ भने, कृपया यो फारम भर्नुहोला र हामीसँग छलफलमा जोडिनु होला। https://t.co/rmQmV8sLSI",59145,4,790,20,93,8,FALSE,FALSE,FALSE,,,FALSE,ne,Nepal,"Minister, Ministry of Education, Science and Technology | @Moest_Nepal 🇳🇵| 📧: secretariat.minister@moest.gov.np",https://sumanashrestha.com.np/,https://sumanashrestha.com.np/,31675,157,373,919,192,13,0,31675,,,,,https://pbs.twimg.com/profile_banners/547853894/1674226811,https://www.twitter.com/SumanaShrestha,https://pbs.twimg.com/profile_images/616529424876306432/xIOqRt9z_normal.png,FALSE,FALSE,"4/8/2012, 1:20:11 AM","7/19/2023, 8:24:42 AM"
1.75413E+18,SumanaShrestha,Sumana,Sumana,,"जुन कुरा नेपालकै प्रविधिका कम्पनीहरुले बनाउन सक्छन्, त्यस्ता सफ्टवेयरहरु नेपालीलाई नै बनाउने मौका दिनुपर्छ! नेपालको टेक-ट्यालेन्ट नेपाल कै प्रविधि विकासका लागि कसरी प्रयोग गर्न सकिन्छ? अब पनि यस बारे नसोच्ने हो भने हामीले नेपालको प्राविधिक विकासलाई तीव्र गतिमा लान सक्नेछैनौं। https://t.co/0vgihUUV1j",32513,5,794,38,113,12,FALSE,FALSE,FALSE,,,FALSE,ne,Nepal,"Minister, Ministry of Education, Science and Technology | @Moest_Nepal 🇳🇵| 📧: secretariat.minister@moest.gov.np",https://sumanashrestha.com.np/,https://sumanashrestha.com.np/,31675,157,373,919,192,13,0,31675,,,,,https://pbs.twimg.com/profile_banners/547853894/1674226811,https://www.twitter.com/SumanaShrestha,https://pbs.twimg.com/profile_images/616529424876306432/xIOqRt9z_normal.png,FALSE,FALSE,"4/8/2012, 1:20:11 AM","2/4/2024, 7:01:23 PM"
1.65664E+18,SumanaShrestha,Sumana,Sumana,,"सबै नेपाली एक हौ।

सडक देखी सदन सम्म। 

भ्रष्टाचार विरुद।

अति भो।

 https://t.co/kLUOkobD14",49708,0,785,35,72,7,FALSE,FALSE,FALSE,,https://fb.watch/ksDcFp0nMT/?mibextid=YCRy0i,FALSE,ne,Nepal,"Minister, Ministry of Education, Science and Technology | @Moest_Nepal 🇳🇵| 📧: secretariat.minister@moest.gov.np",https://sumanashrestha.com.np/,https://sumanashrestha.com.np/,31675,157,373,919,192,13,0,31675,,,,,https://pbs.twimg.com/profile_banners/547853894/1674226811,https://www.twitter.com/SumanaShrestha,https://pbs.twimg.com/profile_images/616529424876306432/xIOqRt9z_normal.png,FALSE,FALSE,"4/8/2012, 1:20:11 AM","5/11/2023, 6:30:02 PM"
1.75705E+18,SumanaShrestha,Sumana,Sumana,,"हाम्रो देशको शिक्षा नीति के हो? लाखौं लाख विद्यार्थी अध्ययन गर्ने विश्वविद्यालयको उपकुलपतिको पदको छनौटमा गम्भीरता खै? देशको भविष्यको सवालमा पनि यहिको उच्च पदाधिकारीहरुको कार्यसम्पादन? प्रधानमन्त्री ज्यूको कार्यसम्पादन यही हो? शिक्षा मन्त्रीज्यूको कार्यसम्पादन यही हो?

मम गर्नु… https://t.co/aOJ0rbhQfH",41714,7,788,53,139,20,FALSE,FALSE,FALSE,,,FALSE,ne,Nepal,"Minister, Ministry of Education, Science and Technology | @Moest_Nepal 🇳🇵| 📧: secretariat.minister@moest.gov.np",https://sumanashrestha.com.np/,https://sumanashrestha.com.np/,31675,157,373,919,192,13,0,31675,,,,,https://pbs.twimg.com/profile_banners/547853894/1674226811,https://www.twitter.com/SumanaShrestha,https://pbs.twimg.com/profile_images/616529424876306432/xIOqRt9z_normal.png,FALSE,FALSE,"4/8/2012, 1:20:11 AM","2/12/2024, 8:36:23 PM"
1.67544E+18,SumanaShrestha,Sumana,Sumana,,"आर्थिक विधेयकको दफावार छलफलमा भाग लिँदै आफ्ना धारणा व्यक्त गरेँ । यो विधेयक वास्तवमा गरीब जनताका लागि बनेकै हैन ।

Vape र e-ciggarettes मा भन्सार दर माफी तर सिसाकलम तिखार्ने(पेन्सिल sharpener) मा दश प्रतिशत (१०%) राख्ने यो कस्तो देश हो ? https://t.co/JBQ1B4nr0r",75222,2,762,35,136,25,FALSE,FALSE,FALSE,,,FALSE,ne,Nepal,"Minister, Ministry of Education, Science and Technology | @Moest_Nepal 🇳🇵| 📧: secretariat.minister@moest.gov.np",https://sumanashrestha.com.np/,https://sumanashrestha.com.np/,31675,157,373,919,192,13,0,31675,,,,,https://pbs.twimg.com/profile_banners/547853894/1674226811,https://www.twitter.com/SumanaShrestha,https://pbs.twimg.com/profile_images/616529424876306432/xIOqRt9z_normal.png,FALSE,FALSE,"4/8/2012, 1:20:11 AM","7/2/2023, 3:30:00 PM"
1.6512E+18,SumanaShrestha,Sumana,Sumana,,"आजको सदनमा गृह मन्त्रीलाई मेरा चार प्रश्नका विषयहरुः

१) मिटरब्याजीका लागि कानून कहिले बनाउने?
२) मिटरब्याजी सम्बन्धी गृह मन्त्रालयको कार्य सम्पादनको मूल्याङ्कन
३) आत्महत्या रोकथामका लागि हटलाईन 
४) डढेलो र विपद् जोखिम न्यूनीकरण व्यवस्थापन https://t.co/0MR5LBEJ7h",34702,0,765,27,111,11,FALSE,FALSE,FALSE,,,FALSE,ne,Nepal,"Minister, Ministry of Education, Science and Technology | @Moest_Nepal 🇳🇵| 📧: secretariat.minister@moest.gov.np",https://sumanashrestha.com.np/,https://sumanashrestha.com.np/,31675,157,373,919,192,13,0,31675,,,,,https://pbs.twimg.com/profile_banners/547853894/1674226811,https://www.twitter.com/SumanaShrestha,https://pbs.twimg.com/profile_images/616529424876306432/xIOqRt9z_normal.png,FALSE,FALSE,"4/8/2012, 1:20:11 AM","4/26/2023, 5:53:04 PM"
1.68991E+18,SumanaShrestha,Sumana,Sumana,,"१) आधिकारिक रुपमा संसद सुचारु गरिदिनु हुन सभामुखज्युमा अनुरोध गर्यौं।
२) संसद अबरुद्ध भएको दिनको तलब/ भत्ता/ सुबिधा फिर्ता गर्ने ब्यवस्था मिलाइदिन हुन अनुरोध गर्यौं। https://t.co/h1NGGtCnC6",33720,1,759,40,78,12,FALSE,FALSE,FALSE,,,FALSE,ne,Nepal,"Minister, Ministry of Education, Science and Technology | @Moest_Nepal 🇳🇵| 📧: secretariat.minister@moest.gov.np",https://sumanashrestha.com.np/,https://sumanashrestha.com.np/,31675,157,373,919,192,13,0,31675,,,,,https://pbs.twimg.com/profile_banners/547853894/1674226811,https://www.twitter.com/SumanaShrestha,https://pbs.twimg.com/profile_images/616529424876306432/xIOqRt9z_normal.png,FALSE,FALSE,"4/8/2012, 1:20:11 AM","8/11/2023, 2:00:17 PM"
1.68623E+18,SumanaShrestha,Sumana,Sumana,,"आईटी सेवा निर्यातबाटै वार्षिक ६७ अर्ब आम्दानी हुने गरेको हिजो प्रकाशित रिपोर्टले बताएको छ। यस्तो परिपेक्षमा सरकारको भूमिका अब के हुनुपर्छ? 

आईटीलाई अझै फस्टाउने उर्वर भूमिको सिर्जना गर्न अब भनेको हामीले हाम्रो आईटी शिक्षाको पद्दतिमा परिवर्तन ल्याउनु आवश्यक देख्दछु। https://t.co/Net6kjWQPt",37473,2,742,15,71,7,FALSE,FALSE,FALSE,,,FALSE,ne,Nepal,"Minister, Ministry of Education, Science and Technology | @Moest_Nepal 🇳🇵| 📧: secretariat.minister@moest.gov.np",https://sumanashrestha.com.np/,https://sumanashrestha.com.np/,31675,157,373,919,192,13,0,31675,,,,,https://pbs.twimg.com/profile_banners/547853894/1674226811,https://www.twitter.com/SumanaShrestha,https://pbs.twimg.com/profile_images/616529424876306432/xIOqRt9z_normal.png,FALSE,FALSE,"4/8/2012, 1:20:11 AM","8/1/2023, 10:11:02 AM"
1.65081E+18,SumanaShrestha,Sumana,Sumana,,"आफ्नो काम कसैले नगर्नु पनि भ्रष्टाचार हो। 

जबसम्म कर्मचारीले राजनैतिक सुरक्षा पाउँछन् तब सम्म जतिसुकै भ्रष्टाचार निवारणका कुरा गरे पनि बालुवामा पानी हाले सरह हुनेछ।आफु भित्र पनि हेरौँ र आफ्नो पार्टी भित्र पनि हेरौँ।

1/2 https://t.co/xplJyAOdfV",32931,2,740,25,87,14,FALSE,FALSE,FALSE,,,FALSE,ne,Nepal,"Minister, Ministry of Education, Science and Technology | @Moest_Nepal 🇳🇵| 📧: secretariat.minister@moest.gov.np",https://sumanashrestha.com.np/,https://sumanashrestha.com.np/,31675,157,373,919,192,13,0,31675,,,,,https://pbs.twimg.com/profile_banners/547853894/1674226811,https://www.twitter.com/SumanaShrestha,https://pbs.twimg.com/profile_images/616529424876306432/xIOqRt9z_normal.png,FALSE,FALSE,"4/8/2012, 1:20:11 AM","4/25/2023, 4:24:36 PM"
1.77472E+18,SumanaShrestha,Sumana,Sumana,,"त्रिभुवन विश्वविद्यालय सेवा आयोगको पद रिक्त हुँदा लामो समयदेखि काम अवरुद्ध भएको थियो। अहिले नाम सिफारिस गर्न गठित छनोट तथा सिफारिस समिति बनेको छ र सोही समितिले ‘त्रिभुवन विश्वविद्यालयको सेवा आयोगको सदस्य सिफारिससम्बन्धी कार्यविधि, २०८० बमोजिम बनाएर दरखास्त आह्वान गरेको छ।… https://t.co/9G74l7H5un",40300,7,735,53,82,7,FALSE,FALSE,FALSE,,,FALSE,ne,Nepal,"Minister, Ministry of Education, Science and Technology | @Moest_Nepal 🇳🇵| 📧: secretariat.minister@moest.gov.np",https://sumanashrestha.com.np/,https://sumanashrestha.com.np/,31675,157,373,919,192,13,0,31675,,,,,https://pbs.twimg.com/profile_banners/547853894/1674226811,https://www.twitter.com/SumanaShrestha,https://pbs.twimg.com/profile_images/616529424876306432/xIOqRt9z_normal.png,FALSE,FALSE,"4/8/2012, 1:20:11 AM","4/1/2024, 2:21:00 PM"
1.75904E+18,SumanaShrestha,Sumana,Sumana,,"आज बैङ्किङ्ग कसुर तथा सजाय ऐन, २०६४ लाई संशोधन गर्न बनेको विधेयक, २०८० सदनमा पेश हुनेछ। हामीले जनताबाट यसबारे संशोधन संकलनको प्रक्रिया जारी राख्दै, आफ्ना संशोधनहरु हामीलाई यो गुगल फारम मार्फत सोमबार सम्म पठाईदिनुहुन अनुरोध गर्दछु। 

संशोधन बुझाउने फारम र विधेयकको पूर्णपाठः… https://t.co/jYJvoRlh5t",34293,5,716,46,71,5,FALSE,FALSE,FALSE,,,FALSE,ne,Nepal,"Minister, Ministry of Education, Science and Technology | @Moest_Nepal 🇳🇵| 📧: secretariat.minister@moest.gov.np",https://sumanashrestha.com.np/,https://sumanashrestha.com.np/,31675,157,373,919,192,13,0,31675,,,,,https://pbs.twimg.com/profile_banners/547853894/1674226811,https://www.twitter.com/SumanaShrestha,https://pbs.twimg.com/profile_images/616529424876306432/xIOqRt9z_normal.png,FALSE,FALSE,"4/8/2012, 1:20:11 AM","2/18/2024, 8:17:28 AM"
1.64363E+18,SumanaShrestha,Sumana,Sumana,,"हामीले संसदमा सुशासनका लागि पाँच प्रस्ताव पेश गरेका थियौँ। सार्वभौम संसद्को उत्पादकत्व, जवाफदेहिता, पारदर्शिता र निश्चित समय तालिकासँग सम्बन्धित हाम्रो प्रयास आंशिक रूपमा सफल भयो।

सहयोग र सद्भावका लागि तपाईँहरूप्रति अनुगृहीत छौँ। हाम्रो प्रयासको पूर्ण विवरण निम्नानुसार रहेको छ। https://t.co/2qCKm3uSkc",36079,0,720,31,80,5,FALSE,FALSE,FALSE,,,FALSE,ne,Nepal,"Minister, Ministry of Education, Science and Technology | @Moest_Nepal 🇳🇵| 📧: secretariat.minister@moest.gov.np",https://sumanashrestha.com.np/,https://sumanashrestha.com.np/,31675,157,373,919,192,13,0,31675,,,,,https://pbs.twimg.com/profile_banners/547853894/1674226811,https://www.twitter.com/SumanaShrestha,https://pbs.twimg.com/profile_images/616529424876306432/xIOqRt9z_normal.png,FALSE,FALSE,"4/8/2012, 1:20:11 AM","4/5/2023, 8:29:59 PM"
1.65487E+18,SumanaShrestha,Sumana,Sumana,,"बजेटको अधिवेशन भोली बाट सुरु हुँदै छ। समय अत्यन्तै थोरै छ - तर सकेसम्म अहिलेसम्मको शिक्षा र सूचना मन्त्रालयको बजेट हेर्न यहाँहरुको सहयोगको माग र अपेक्षा गर्दै छु। शिक्षा, र सूचना संचार मन्त्रालयहरुको र महालेखाको प्रतिवेदनहरु अध्ययन गर्नुहोला र हामीलाई समीक्षाहरु पठाउनु होला।

1/2 https://t.co/SKrXYnk5uP",31389,2,708,14,57,2,FALSE,FALSE,FALSE,,,FALSE,ne,Nepal,"Minister, Ministry of Education, Science and Technology | @Moest_Nepal 🇳🇵| 📧: secretariat.minister@moest.gov.np",https://sumanashrestha.com.np/,https://sumanashrestha.com.np/,31675,157,373,919,192,13,0,31675,,,,,https://pbs.twimg.com/profile_banners/547853894/1674226811,https://www.twitter.com/SumanaShrestha,https://pbs.twimg.com/profile_images/616529424876306432/xIOqRt9z_normal.png,FALSE,FALSE,"4/8/2012, 1:20:11 AM","5/6/2023, 8:56:57 PM"
1.62472E+18,SumanaShrestha,Sumana,Sumana,,"हामीले सरकारको राजस्व मात्र बढाउने कुरा गरीरहेका छौ, नीजि क्षेत्रको राजस्व बढाउन कस्तो खालको कार्यक्रम तथा नीति ल्याउछौँ? त्यो पनि सोच्न आवश्यक छ। नीजि क्षेत्रको राजस्व बढे मात्र सरकारको राजस्व बढ्न सम्भव छ। 

आजको सदनमा अर्थ मन्त्रीलाई मेरा पाँच प्रश्नः https://t.co/ZgD7f0v7nr",74786,5,708,39,62,10,FALSE,FALSE,FALSE,,,FALSE,ne,Nepal,"Minister, Ministry of Education, Science and Technology | @Moest_Nepal 🇳🇵| 📧: secretariat.minister@moest.gov.np",https://sumanashrestha.com.np/,https://sumanashrestha.com.np/,31675,157,373,919,192,13,0,31675,,,,,https://pbs.twimg.com/profile_banners/547853894/1674226811,https://www.twitter.com/SumanaShrestha,https://pbs.twimg.com/profile_images/616529424876306432/xIOqRt9z_normal.png,FALSE,FALSE,"4/8/2012, 1:20:11 AM","2/12/2023, 4:28:40 PM"
1.65551E+18,SumanaShrestha,Sumana,Sumana,,अर्थमन्त्री बिना बजेटका सिद्धान्त र प्रथमिकताको कुरा गर्नुको कुनै अर्थ छैन। जवाफदेहिता अपरिहार्य छ! कर्मकान्डी बजेटका छलफल हुन दिनुहुँदैन। यसकारण आज मैले हाम्रो प्रतिनिधि सभा नियमावली दफा ६(५) सम्झाउँदै नियमापत्ति गरेँ। अर्थ मन्त्रीलाई फर्काएरै छाड्यौँ। https://t.co/tMy0fVPXcy,33582,2,706,31,70,6,FALSE,FALSE,FALSE,,,FALSE,ne,Nepal,"Minister, Ministry of Education, Science and Technology | @Moest_Nepal 🇳🇵| 📧: secretariat.minister@moest.gov.np",https://sumanashrestha.com.np/,https://sumanashrestha.com.np/,31675,157,373,919,192,13,0,31675,,,,,https://pbs.twimg.com/profile_banners/547853894/1674226811,https://www.twitter.com/SumanaShrestha,https://pbs.twimg.com/profile_images/616529424876306432/xIOqRt9z_normal.png,FALSE,FALSE,"4/8/2012, 1:20:11 AM","5/8/2023, 3:28:51 PM"
1.75833E+18,SumanaShrestha,Sumana,Sumana,,बौद्धिक चोरीलाई सामान्य नमानौ। https://t.co/PPtsakUUFa,60323,3,710,48,91,27,FALSE,FALSE,FALSE,,,FALSE,ne,Nepal,"Minister, Ministry of Education, Science and Technology | @Moest_Nepal 🇳🇵| 📧: secretariat.minister@moest.gov.np",https://sumanashrestha.com.np/,https://sumanashrestha.com.np/,31675,157,373,919,192,13,0,31675,,,,,https://pbs.twimg.com/profile_banners/547853894/1674226811,https://www.twitter.com/SumanaShrestha,https://pbs.twimg.com/profile_images/616529424876306432/xIOqRt9z_normal.png,FALSE,FALSE,"4/8/2012, 1:20:11 AM","2/16/2024, 9:14:21 AM"
1.66637E+18,SumanaShrestha,Sumana,Sumana,,"यदि खाद्यवस्तुको मूल्य १० प्रतिशतले बढ्यो भने गरिबी ४ प्रतिशतले बढ्छ। खाद्यवस्तुमा १ प्रतिशत मूल्य बढ्यो भने १ लाख मान्छेहरू गरिबीको रेखामुनि जानेछन् र १ लाख ८० हजार खाद्य-गरिब (food poor) हुनेछन्।  सरकारको दया माया हैन, सामाजिक न्याय चाहिएको छ। के गरेको यो सरकारले? https://t.co/H7bZd6ANdM",41023,5,693,35,158,11,FALSE,FALSE,FALSE,,,FALSE,ne,Nepal,"Minister, Ministry of Education, Science and Technology | @Moest_Nepal 🇳🇵| 📧: secretariat.minister@moest.gov.np",https://sumanashrestha.com.np/,https://sumanashrestha.com.np/,31675,157,373,919,192,13,0,31675,,,,,https://pbs.twimg.com/profile_banners/547853894/1674226811,https://www.twitter.com/SumanaShrestha,https://pbs.twimg.com/profile_images/616529424876306432/xIOqRt9z_normal.png,FALSE,FALSE,"4/8/2012, 1:20:11 AM","6/7/2023, 2:31:43 PM"
