tweet_id,username,name,first_name,last_name,full_text,view_count,bookmark_count,favorite_count,reply_count,retweet_count,quote_count,bookmarked,favorited,retweeted,user_mentions,url_mentions,is_quote_status,lang,location,bio,website,websites,followers_count,following_count,media_count,statuses_count,favourites_count,listed_count,fast_followers_count,normal_followers_count,followed_by,following,can_dm,can_media_tag,profile_banner_url,profile_url,avatar_url,verified,is_blue_verified,user_created_at,created_at
1.65554E+18,SumanaShrestha,Sumana,Sumana,,"हाम्रो बजेटको सिद्धान्त र बजेट बनाउने शैलीमा प्रणालीगत विफलता (systematic failure) नै भएको छ - न बजेटको सिद्धान्तमा संस्थागत स्मरण (Institutional memory) गर्ने प्रचलन छ, न तीन तहका सरकारबीच न मन्त्रालयहरूबीच समन्वयन छ, न त बजेटमा सफलता र उपलब्धीको मापन वा मुल्यांकन नै।

1/2 https://t.co/qYnlEurZqc",37531,1,695,20,75,8,FALSE,FALSE,FALSE,,,FALSE,ne,Nepal,"Minister, Ministry of Education, Science and Technology | @Moest_Nepal 🇳🇵| 📧: secretariat.minister@moest.gov.np",https://sumanashrestha.com.np/,https://sumanashrestha.com.np/,31675,157,373,919,192,13,0,31675,,,,,https://pbs.twimg.com/profile_banners/547853894/1674226811,https://www.twitter.com/SumanaShrestha,https://pbs.twimg.com/profile_images/616529424876306432/xIOqRt9z_normal.png,FALSE,FALSE,"4/8/2012, 1:20:11 AM","5/8/2023, 5:42:00 PM"
1.66456E+18,SumanaShrestha,Sumana,Sumana,,अब बजेटको बारे छलफल आइतबारबाट सुरु हुँदै छ। त्यसका लागि यहाँहरुले पनि बजेट हेर्नुहोला। यो बजेट कसरी विनीयोजन हुन्छ भन्ने कुरा आफ्नो स्थानीय तहमा पनि ध्यान दिनुहोला। हामी नीरन्तर यसमा लागि नै रहने छौँ। यसकारण यहाँहरुको सतर्कता र निरीक्षण आवश्यक छ। https://t.co/nxTMGZqiaJ,26421,4,690,26,84,4,FALSE,FALSE,FALSE,,,FALSE,ne,Nepal,"Minister, Ministry of Education, Science and Technology | @Moest_Nepal 🇳🇵| 📧: secretariat.minister@moest.gov.np",https://sumanashrestha.com.np/,https://sumanashrestha.com.np/,31675,157,373,919,192,13,0,31675,,,,,https://pbs.twimg.com/profile_banners/547853894/1674226811,https://www.twitter.com/SumanaShrestha,https://pbs.twimg.com/profile_images/616529424876306432/xIOqRt9z_normal.png,FALSE,FALSE,"4/8/2012, 1:20:11 AM","6/2/2023, 3:08:08 PM"
1.62974E+18,SumanaShrestha,Sumana,Sumana,,"सम्पत्ति शुद्धिकरण सम्बन्धी केही ऐनलाई संशोधन गर्न बनेको विधेयक, २०७९ मा हामीले ६-बुँदे संशोधन प्रस्ताव बुझाएका छौँ। जनताबाट आएका सुझावका लागि धेरै धन्यवाद।

हाम्रा संशोधन, जनताले बुझाएका सुझाव र हाम्रा प्रतिक्रिया सबै यहाँ हेर्न सक्नुहुन्छः https://t.co/BQOY5i37H9 https://t.co/QiGt2SLWw2",39716,0,690,12,48,4,FALSE,FALSE,FALSE,,https://sumanashrestha.com.np/parliament/bills/2023-02/aml/,FALSE,ne,Nepal,"Minister, Ministry of Education, Science and Technology | @Moest_Nepal 🇳🇵| 📧: secretariat.minister@moest.gov.np",https://sumanashrestha.com.np/,https://sumanashrestha.com.np/,31675,157,373,919,192,13,0,31675,,,,,https://pbs.twimg.com/profile_banners/547853894/1674226811,https://www.twitter.com/SumanaShrestha,https://pbs.twimg.com/profile_images/616529424876306432/xIOqRt9z_normal.png,FALSE,FALSE,"4/8/2012, 1:20:11 AM","2/26/2023, 12:33:58 PM"
1.63122E+18,SumanaShrestha,Sumana,Sumana,,"कानुनको मस्यौदाहरू पेश गर्ने मन्त्रालयहरूबाट भएको देख्दा अचम्म लागिरहेको छ। किनभने कानुन त जनप्रतिनिधि ले बनाउनु पर्ने हो, सदनले बनाउनु पर्ने हो। सदनलाई त ७२ घण्टा संशोधन पेश गर्ने मात्र समय दिईन्छ र ऐन बनाउँदा हुनुपर्ने छलफल पनि अपुग भएको महसुस भईरहेको छ।

सुधारका क्षेत्रः https://t.co/3ZIZFhCf7e",36144,3,681,28,69,9,FALSE,FALSE,FALSE,,,FALSE,ne,Nepal,"Minister, Ministry of Education, Science and Technology | @Moest_Nepal 🇳🇵| 📧: secretariat.minister@moest.gov.np",https://sumanashrestha.com.np/,https://sumanashrestha.com.np/,31675,157,373,919,192,13,0,31675,,,,,https://pbs.twimg.com/profile_banners/547853894/1674226811,https://www.twitter.com/SumanaShrestha,https://pbs.twimg.com/profile_images/616529424876306432/xIOqRt9z_normal.png,FALSE,FALSE,"4/8/2012, 1:20:11 AM","3/2/2023, 2:53:19 PM"
1.70395E+18,SumanaShrestha,Sumana,Sumana,,"“नेपालबाट रातो पासपोर्ट प्रयोग गरेर विदेश जाने जो कोही सार्वजनिक पद धारण गरेका व्यक्तिले भ्रमण सम्पन्न गरेर फर्किएपछि त्यसको उपलब्धि र सिकेका पाठ सार्वजनिक गर्ने परिपाटी स्थापना गरौं ।

मेरा केही सिकाई G-CAP बाट।

https://t.co/Dr2SKxM6Ko",29154,4,672,33,101,5,FALSE,FALSE,FALSE,,https://ekantipur.com/opinion/2023/09/19/169508567240227942.html,FALSE,ne,Nepal,"Minister, Ministry of Education, Science and Technology | @Moest_Nepal 🇳🇵| 📧: secretariat.minister@moest.gov.np",https://sumanashrestha.com.np/,https://sumanashrestha.com.np/,31675,157,373,919,192,13,0,31675,,,,,https://pbs.twimg.com/profile_banners/547853894/1674226811,https://www.twitter.com/SumanaShrestha,https://pbs.twimg.com/profile_images/616529424876306432/xIOqRt9z_normal.png,FALSE,FALSE,"4/8/2012, 1:20:11 AM","9/19/2023, 7:33:20 AM"
1.66273E+18,SumanaShrestha,Sumana,Sumana,,"अल्पमतमा भए पनि आफुलाई लागेका कुराहरुमा अडिग रहनुपर्छ। मैले संयुक्त बैठक र संयुक्त समिति (कार्यसञ्चालन) नियमावलीमा राखेका संशोधन फिर्ता लिईनँ। परराष्ट्र नीति संस्थागत गर्ने, दबाब, प्रभाव र प्रलोभनमा नियुक्तिको चलन हटाउने र उजुरीका छानबिनमा पारदर्शीताको माग - सबै अस्वीकार भए। https://t.co/wabgKzEKML",44008,0,672,51,91,21,FALSE,FALSE,FALSE,,,FALSE,ne,Nepal,"Minister, Ministry of Education, Science and Technology | @Moest_Nepal 🇳🇵| 📧: secretariat.minister@moest.gov.np",https://sumanashrestha.com.np/,https://sumanashrestha.com.np/,31675,157,373,919,192,13,0,31675,,,,,https://pbs.twimg.com/profile_banners/547853894/1674226811,https://www.twitter.com/SumanaShrestha,https://pbs.twimg.com/profile_images/616529424876306432/xIOqRt9z_normal.png,FALSE,FALSE,"4/8/2012, 1:20:11 AM","5/28/2023, 1:37:40 PM"
1.65554E+18,SumanaShrestha,Sumana,Sumana,,2/2 https://t.co/wQuu2JtXVy,45234,1,664,22,80,5,FALSE,FALSE,FALSE,,,FALSE,und,Nepal,"Minister, Ministry of Education, Science and Technology | @Moest_Nepal 🇳🇵| 📧: secretariat.minister@moest.gov.np",https://sumanashrestha.com.np/,https://sumanashrestha.com.np/,31675,157,373,919,192,13,0,31675,,,,,https://pbs.twimg.com/profile_banners/547853894/1674226811,https://www.twitter.com/SumanaShrestha,https://pbs.twimg.com/profile_images/616529424876306432/xIOqRt9z_normal.png,FALSE,FALSE,"4/8/2012, 1:20:11 AM","5/8/2023, 5:43:28 PM"
1.66267E+18,SumanaShrestha,Sumana,Sumana,,हिजोको सदनमा नीति तथा कार्यक्रममा मैले राखेका सम्सोधन पारित भएन । आउने बजेटलाई मीतव्ययी बनाउने सक्दो प्रयास गरेकी थिए । https://t.co/LFY63vgpz3,104053,0,666,68,70,30,FALSE,FALSE,FALSE,,,FALSE,ne,Nepal,"Minister, Ministry of Education, Science and Technology | @Moest_Nepal 🇳🇵| 📧: secretariat.minister@moest.gov.np",https://sumanashrestha.com.np/,https://sumanashrestha.com.np/,31675,157,373,919,192,13,0,31675,,,,,https://pbs.twimg.com/profile_banners/547853894/1674226811,https://www.twitter.com/SumanaShrestha,https://pbs.twimg.com/profile_images/616529424876306432/xIOqRt9z_normal.png,FALSE,FALSE,"4/8/2012, 1:20:11 AM","5/28/2023, 9:46:46 AM"
1.68295E+18,SumanaShrestha,Sumana,Sumana,,"शिक्षा, स्वास्थ्य तथा सूचना प्रविधि समितिको बैठकमा त्रिभुवन विश्वविद्यालयका पदाधिकारीहरू आउँदै हुनुहुन्छ। हामीले त्रिविका बारे भूतपूर्व तथा अध्ययनरत विद्यार्थीलाई आफ्ना अनुभवहरू यहाँ व्यक्त गर्न आह्वान गर्दछौँ।

Link: https://t.co/po2EzTEONz https://t.co/4peqrULPHI",54949,0,667,107,77,9,FALSE,FALSE,FALSE,,https://forms.gle/QzHwqFago2AbDhYeA,FALSE,ne,Nepal,"Minister, Ministry of Education, Science and Technology | @Moest_Nepal 🇳🇵| 📧: secretariat.minister@moest.gov.np",https://sumanashrestha.com.np/,https://sumanashrestha.com.np/,31675,157,373,919,192,13,0,31675,,,,,https://pbs.twimg.com/profile_banners/547853894/1674226811,https://www.twitter.com/SumanaShrestha,https://pbs.twimg.com/profile_images/616529424876306432/xIOqRt9z_normal.png,FALSE,FALSE,"4/8/2012, 1:20:11 AM","7/23/2023, 8:32:59 AM"
1.67079E+18,SumanaShrestha,Sumana,Sumana,,"नर्सहरूलाई महिनामा १५ हजार तलब दिएर राख्न खोज्छौँ, अनि विदेशिन्नन् त? अब विदेश गएर १५ हजारको ठाउँमा २ लाख नकमाउ भनेर कुन मुखले भन्ने? https://t.co/P9cMyDBef7",29225,3,660,20,58,4,FALSE,FALSE,FALSE,,,FALSE,ne,Nepal,"Minister, Ministry of Education, Science and Technology | @Moest_Nepal 🇳🇵| 📧: secretariat.minister@moest.gov.np",https://sumanashrestha.com.np/,https://sumanashrestha.com.np/,31675,157,373,919,192,13,0,31675,,,,,https://pbs.twimg.com/profile_banners/547853894/1674226811,https://www.twitter.com/SumanaShrestha,https://pbs.twimg.com/profile_images/616529424876306432/xIOqRt9z_normal.png,FALSE,FALSE,"4/8/2012, 1:20:11 AM","6/19/2023, 7:25:49 PM"
1.7494E+18,SumanaShrestha,Sumana,Sumana,,पढ़ी दिनु होला। https://t.co/wxrKPsxGGG,87778,7,646,166,76,46,FALSE,FALSE,FALSE,,,FALSE,ne,Nepal,"Minister, Ministry of Education, Science and Technology | @Moest_Nepal 🇳🇵| 📧: secretariat.minister@moest.gov.np",https://sumanashrestha.com.np/,https://sumanashrestha.com.np/,31675,157,373,919,192,13,0,31675,,,,,https://pbs.twimg.com/profile_banners/547853894/1674226811,https://www.twitter.com/SumanaShrestha,https://pbs.twimg.com/profile_images/616529424876306432/xIOqRt9z_normal.png,FALSE,FALSE,"4/8/2012, 1:20:11 AM","1/22/2024, 5:23:23 PM"
1.62838E+18,SumanaShrestha,Sumana,Sumana,,हामी कानुन कमजोर भएर ग्रे लिस्टमा पार्न लागेको हो कि कार्यान्वयन कमजोर भएर? पेश भएको यो विधेयकको एक प्रावधान सर्वोच्च अदालतले २०६७मा स्थापित नजिरको विरुद्ध गएको हो कि? स्रोत खुलाउन नसकेको सम्पतिमा कर लिनु भनेको के हो? हाम्रो कमी कमजोरी बारेमा बनाएको रिपोर्ट किन सार्वजनिक छैन? 1/2 https://t.co/LDvwxSeLaj,47186,2,645,20,69,14,FALSE,FALSE,FALSE,,,FALSE,ne,Nepal,"Minister, Ministry of Education, Science and Technology | @Moest_Nepal 🇳🇵| 📧: secretariat.minister@moest.gov.np",https://sumanashrestha.com.np/,https://sumanashrestha.com.np/,31675,157,373,919,192,13,0,31675,,,,,https://pbs.twimg.com/profile_banners/547853894/1674226811,https://www.twitter.com/SumanaShrestha,https://pbs.twimg.com/profile_images/616529424876306432/xIOqRt9z_normal.png,FALSE,FALSE,"4/8/2012, 1:20:11 AM","2/22/2023, 6:39:15 PM"
1.64607E+18,SumanaShrestha,Sumana,Sumana,,सङ्घीय मामिला तथा सामान्य प्रशासन मन्‍त्रालयका मन्त्रीलाई आज निजामति सेवा बारे मेरा ८ प्रश्नहरूः https://t.co/DqARulmjjR,105060,3,645,43,80,40,FALSE,FALSE,FALSE,,,FALSE,ne,Nepal,"Minister, Ministry of Education, Science and Technology | @Moest_Nepal 🇳🇵| 📧: secretariat.minister@moest.gov.np",https://sumanashrestha.com.np/,https://sumanashrestha.com.np/,31675,157,373,919,192,13,0,31675,,,,,https://pbs.twimg.com/profile_banners/547853894/1674226811,https://www.twitter.com/SumanaShrestha,https://pbs.twimg.com/profile_images/616529424876306432/xIOqRt9z_normal.png,FALSE,FALSE,"4/8/2012, 1:20:11 AM","4/12/2023, 2:13:18 PM"
1.6873E+18,SumanaShrestha,Sumana,Sumana,,"हामीसँग दशकौँ वर्ष पुराना कानुन कुन कुन छन् ? समय सान्दर्भिक नरहेका परिवर्तन गर्नुपर्ने कानुन कतिवटा छ ? सरकारसँग सूची माग्दा पनि थाहा छैन ।

यो बृहत् अध्ययन गर्न हामीलाई जुन स्रोत र जनशक्ति चाहिन्छ, त्यो पनि छैन । क्रमशः पार्टी बृहत हुँदै जाँदा सुधारका सबै पाटोलाई समेट्नेछौँ । https://t.co/7PiKlTyW8O",26956,3,644,31,72,3,FALSE,FALSE,FALSE,,,FALSE,ne,Nepal,"Minister, Ministry of Education, Science and Technology | @Moest_Nepal 🇳🇵| 📧: secretariat.minister@moest.gov.np",https://sumanashrestha.com.np/,https://sumanashrestha.com.np/,31675,157,373,919,192,13,0,31675,,,,,https://pbs.twimg.com/profile_banners/547853894/1674226811,https://www.twitter.com/SumanaShrestha,https://pbs.twimg.com/profile_images/616529424876306432/xIOqRt9z_normal.png,FALSE,FALSE,"4/8/2012, 1:20:11 AM","8/4/2023, 9:08:23 AM"
1.65802E+18,SumanaShrestha,Sumana,Sumana,,"सरकारका प्राथमिकता के हुन्?  

नैतिक प्रहरी बन्ने की संसदीय समितिहरूको बैठक तय गर्ने? भ्रष्टाचार काण्डको यो निर्णायक समयमा यो विचलित गर्ने रणनीति किन प्रयोग गरिएको छ? 

समय निकै भएकैले होला टिसर्ट र जिन्समा अड्किनु भएको।   

#Nepal #RSP #ghanti https://t.co/SzCPWWc84w",118840,1,637,116,119,28,FALSE,FALSE,FALSE,,,FALSE,ne,Nepal,"Minister, Ministry of Education, Science and Technology | @Moest_Nepal 🇳🇵| 📧: secretariat.minister@moest.gov.np",https://sumanashrestha.com.np/,https://sumanashrestha.com.np/,31675,157,373,919,192,13,0,31675,,,,,https://pbs.twimg.com/profile_banners/547853894/1674226811,https://www.twitter.com/SumanaShrestha,https://pbs.twimg.com/profile_images/616529424876306432/xIOqRt9z_normal.png,FALSE,FALSE,"4/8/2012, 1:20:11 AM","5/15/2023, 2:03:57 PM"
1.62574E+18,SumanaShrestha,Sumana,Sumana,,सन्दिप लामिछानेको मुद्दा -त्यो कहिलेसम्म छिनोफानो गर्छौँ? न्यायमा ढिला सुस्तीका कारण पीडितकाे सुरक्षा र मनाेसामाजिक अवस्था झनै कमजोर भईरहेको छ। यतिका समय लाग्ने हो भने आरोपितको नाम किन सार्वजनिक गरियो? एउटा बलात्कार आरोपितलाई राष्ट्रको प्रतिनिधि बनाउन हाम्रो नैतिकताले कसरी दियो? https://t.co/0PkXNnt7ev,65424,6,639,56,85,20,FALSE,FALSE,FALSE,,,FALSE,ne,Nepal,"Minister, Ministry of Education, Science and Technology | @Moest_Nepal 🇳🇵| 📧: secretariat.minister@moest.gov.np",https://sumanashrestha.com.np/,https://sumanashrestha.com.np/,31675,157,373,919,192,13,0,31675,,,,,https://pbs.twimg.com/profile_banners/547853894/1674226811,https://www.twitter.com/SumanaShrestha,https://pbs.twimg.com/profile_images/616529424876306432/xIOqRt9z_normal.png,FALSE,FALSE,"4/8/2012, 1:20:11 AM","2/15/2023, 12:13:20 PM"
1.75006E+18,SumanaShrestha,Sumana,Sumana,,"हामीले नेपाल मेडिकल काउन्सिलमा तीन महत्त्वपूर्ण प्रश्नहरु सोधेका छौंः
१) लिङ्गभेदी भ्रुण हत्या बारे 
२) अस्पतालहरूमा बिरामीको मृत्यु पश्चात कारण खोज्ने बारे प्रकृया बारे
३) बिरामी पक्ष र स्वास्थ्यसंस्थाबीच विवाद हुँदा कथित लापरवाही(malpractice) हो/होइन भनेर निर्क्यौल गर्ने बारे https://t.co/76rUiIOmvC",233902,6,634,105,147,110,FALSE,FALSE,FALSE,,,FALSE,ne,Nepal,"Minister, Ministry of Education, Science and Technology | @Moest_Nepal 🇳🇵| 📧: secretariat.minister@moest.gov.np",https://sumanashrestha.com.np/,https://sumanashrestha.com.np/,31675,157,373,919,192,13,0,31675,,,,,https://pbs.twimg.com/profile_banners/547853894/1674226811,https://www.twitter.com/SumanaShrestha,https://pbs.twimg.com/profile_images/616529424876306432/xIOqRt9z_normal.png,FALSE,FALSE,"4/8/2012, 1:20:11 AM","1/24/2024, 1:01:48 PM"
1.70071E+18,SumanaShrestha,Sumana,Sumana,,"आत्महत्या न समाधान हो, न बहादुरी हो,  न त कायरता नै हो ।  

आत्माहत्याको विचार आएमा Suicide  Prevention  hotline ११६६ मा फोन गर्नुहोस् अथवा आफ्नु नजिकको साथी, परिवारलाई थाहा दिनुहोस । https://t.co/On4J4ItzsX",23517,3,628,29,107,4,FALSE,FALSE,FALSE,,,FALSE,ne,Nepal,"Minister, Ministry of Education, Science and Technology | @Moest_Nepal 🇳🇵| 📧: secretariat.minister@moest.gov.np",https://sumanashrestha.com.np/,https://sumanashrestha.com.np/,31675,157,373,919,192,13,0,31675,,,,,https://pbs.twimg.com/profile_banners/547853894/1674226811,https://www.twitter.com/SumanaShrestha,https://pbs.twimg.com/profile_images/616529424876306432/xIOqRt9z_normal.png,FALSE,FALSE,"4/8/2012, 1:20:11 AM","9/10/2023, 9:20:52 AM"
1.75697E+18,SumanaShrestha,Sumana,Sumana,,अब बल्ल सांसदहरुले बौद्धिक चोरीका बारे गम्भीर रुपमा लिन थाल्नुभएको छ। 'उपकुलपति'को पद रिक्त हुनु अगावै देखि नै पदपूर्तिका लागि प्रक्रिया अगाडि बढाउनुपर्छ भनेर बारम्बार भनिरहदा पनि सुनुवाई भएन। सर्टलिस्ट भएका उम्मेद्द्वार कोही बौद्धिक चोरीका आरोपित छन् त कोही भ्रष्टाचारका छनबिनमा… https://t.co/MOUemeFpjX,69622,4,626,29,115,23,FALSE,FALSE,FALSE,,,FALSE,ne,Nepal,"Minister, Ministry of Education, Science and Technology | @Moest_Nepal 🇳🇵| 📧: secretariat.minister@moest.gov.np",https://sumanashrestha.com.np/,https://sumanashrestha.com.np/,31675,157,373,919,192,13,0,31675,,,,,https://pbs.twimg.com/profile_banners/547853894/1674226811,https://www.twitter.com/SumanaShrestha,https://pbs.twimg.com/profile_images/616529424876306432/xIOqRt9z_normal.png,FALSE,FALSE,"4/8/2012, 1:20:11 AM","2/12/2024, 3:15:20 PM"
1.76283E+18,SumanaShrestha,Sumana,Sumana,,"यदि तपाईँले नेपालका सडकहरूमा यात्रा गर्नुभएको छ भने, उपडखापड सडकमा धुलाम्मे गाडी नै सब भन्दा पहिले याद आउँछ होला। यात्रा काठमाडौँमा होस् वा विराटनगरमा होस् वा बुटवलमा होस् वा कर्णालीमा होस्, गन्तव्यको छापभन्दा यात्राका अवरोधहरू हामीलाई बढी याद हुन्छन्।  यात्रामा हामीले समस्या… https://t.co/yPMaxDXbSv",43359,6,625,36,76,12,FALSE,FALSE,FALSE,,,FALSE,ne,Nepal,"Minister, Ministry of Education, Science and Technology | @Moest_Nepal 🇳🇵| 📧: secretariat.minister@moest.gov.np",https://sumanashrestha.com.np/,https://sumanashrestha.com.np/,31675,157,373,919,192,13,0,31675,,,,,https://pbs.twimg.com/profile_banners/547853894/1674226811,https://www.twitter.com/SumanaShrestha,https://pbs.twimg.com/profile_images/616529424876306432/xIOqRt9z_normal.png,FALSE,FALSE,"4/8/2012, 1:20:11 AM","2/28/2024, 7:08:27 PM"
1.75958E+18,SumanaShrestha,Sumana,Sumana,,"भाग नपाए मात्र भागबण्डाको विरोध ?  

प्रधानमन्त्री-शिक्षामन्त्री नै विश्वविद्यालयको कुलपति/सह-कुलपति हुने व्यवस्था यथावत छ! भागबण्डामा नियुक्ति हुँदै गर्दा त्रिविको १६ अर्ब बेरुजु छ - यसमा नजर पर्दैन। छनौट मापदण्डका समस्या र अस्पष्टताबारे यत्रो आवाज उठाउदा चुप बस्ने। वर्षौँदेखि…",91774,4,619,34,97,24,FALSE,FALSE,FALSE,,,TRUE,ne,Nepal,"Minister, Ministry of Education, Science and Technology | @Moest_Nepal 🇳🇵| 📧: secretariat.minister@moest.gov.np",https://sumanashrestha.com.np/,https://sumanashrestha.com.np/,31675,157,373,919,192,13,0,31675,,,,,https://pbs.twimg.com/profile_banners/547853894/1674226811,https://www.twitter.com/SumanaShrestha,https://pbs.twimg.com/profile_images/616529424876306432/xIOqRt9z_normal.png,FALSE,FALSE,"4/8/2012, 1:20:11 AM","2/19/2024, 7:44:50 PM"
1.64246E+18,SumanaShrestha,Sumana,Sumana,,"हामी बाँधिन्छौ भनेर हामी डराउन मिल्छ? आफूलाई मात्रै सजिलो हुने गरी नियम बनाउनु कत्तिको उचित हुन्छ? 

आजको सदनमा मेरो वक्तव्य (1) https://t.co/jlIDDluwc0",65371,4,605,13,94,17,FALSE,FALSE,FALSE,,,FALSE,ne,Nepal,"Minister, Ministry of Education, Science and Technology | @Moest_Nepal 🇳🇵| 📧: secretariat.minister@moest.gov.np",https://sumanashrestha.com.np/,https://sumanashrestha.com.np/,31675,157,373,919,192,13,0,31675,,,,,https://pbs.twimg.com/profile_banners/547853894/1674226811,https://www.twitter.com/SumanaShrestha,https://pbs.twimg.com/profile_images/616529424876306432/xIOqRt9z_normal.png,FALSE,FALSE,"4/8/2012, 1:20:11 AM","4/2/2023, 3:21:01 PM"
