tweet_id,username,name,first_name,last_name,full_text,view_count,bookmark_count,favorite_count,reply_count,retweet_count,quote_count,bookmarked,favorited,retweeted,user_mentions,url_mentions,is_quote_status,lang,location,bio,website,websites,followers_count,following_count,media_count,statuses_count,favourites_count,listed_count,fast_followers_count,normal_followers_count,followed_by,following,can_dm,can_media_tag,profile_banner_url,profile_url,avatar_url,verified,is_blue_verified,user_created_at,created_at
1.6545E+18,SumanaShrestha,Sumana,Sumana,,रा स्व पा प्रतिपक्षमा। साथीहरु अब यो आशाको दियो जोगाएर लानु छ। सधै र संगै नेपाल र नेपालीमा समर्पित ।,47769,0,1097,85,81,18,FALSE,FALSE,FALSE,,,FALSE,ne,Nepal,"Minister, Ministry of Education, Science and Technology | @Moest_Nepal 🇳🇵| 📧: secretariat.minister@moest.gov.np",https://sumanashrestha.com.np/,https://sumanashrestha.com.np/,31675,157,373,919,192,13,0,31675,,,,,https://pbs.twimg.com/profile_banners/547853894/1674226811,https://www.twitter.com/SumanaShrestha,https://pbs.twimg.com/profile_images/616529424876306432/xIOqRt9z_normal.png,FALSE,FALSE,"4/8/2012, 1:20:11 AM","5/5/2023, 8:28:25 PM"
1.65187E+18,SumanaShrestha,Sumana,Sumana,,आजको सुन्य समयमा मेरो वक्तव्य: https://t.co/oVjorwmjRp,63083,0,1074,49,129,19,FALSE,FALSE,FALSE,,,FALSE,ne,Nepal,"Minister, Ministry of Education, Science and Technology | @Moest_Nepal 🇳🇵| 📧: secretariat.minister@moest.gov.np",https://sumanashrestha.com.np/,https://sumanashrestha.com.np/,31675,157,373,919,192,13,0,31675,,,,,https://pbs.twimg.com/profile_banners/547853894/1674226811,https://www.twitter.com/SumanaShrestha,https://pbs.twimg.com/profile_images/616529424876306432/xIOqRt9z_normal.png,FALSE,FALSE,"4/8/2012, 1:20:11 AM","4/28/2023, 2:32:31 PM"
1.6467E+18,SumanaShrestha,Sumana,Sumana,,"✨नेपाली नयाँ वर्ष २०८०को हार्दिक शुभकामना! आगामी दिनहरु नयाँ आशा, नयाँ उत्साह, नयाँ संघर्ष र नयाँ सफलताहरुको सुरुवात बनोस्। यो नयाँ वर्ष सबैको लागि खुशी, समृद्धि, शान्ति र स्वास्थ्यले भरीपूर्ण होओस्।✨

#Nepal https://t.co/Wyuc9t1p9N",38522,0,1068,69,23,2,FALSE,FALSE,FALSE,,,FALSE,ne,Nepal,"Minister, Ministry of Education, Science and Technology | @Moest_Nepal 🇳🇵| 📧: secretariat.minister@moest.gov.np",https://sumanashrestha.com.np/,https://sumanashrestha.com.np/,31675,157,373,919,192,13,0,31675,,,,,https://pbs.twimg.com/profile_banners/547853894/1674226811,https://www.twitter.com/SumanaShrestha,https://pbs.twimg.com/profile_images/616529424876306432/xIOqRt9z_normal.png,FALSE,FALSE,"4/8/2012, 1:20:11 AM","4/14/2023, 7:48:06 AM"
1.62758E+18,SumanaShrestha,Sumana,Sumana,,"आउनुहोस्, अब ""सम्पत्ति शुद्दिकरण (मनी लाउन्डरीङ्ग) निवारण तथा व्यावसायिक वातवरण प्रवद्धधन सम्बन्धी केही ऐनलाई संशोधन गर्न बनेको विधेयक"" माथि हाम्रो 'विधेयक मन्थन'बाट जोडिनुहोस्। 

फारममा आफ्ना संशोधन सुझाव फाल्गुन ११ गते, बिहिबार १० बजे सम्म बुझाउनु होलाः https://t.co/SV9xJAfqiq https://t.co/Bz5nx47g8x",124461,2,1070,54,151,31,FALSE,FALSE,FALSE,,https://forms.gle/K3uaicco6oiEUfTg7,FALSE,ne,Nepal,"Minister, Ministry of Education, Science and Technology | @Moest_Nepal 🇳🇵| 📧: secretariat.minister@moest.gov.np",https://sumanashrestha.com.np/,https://sumanashrestha.com.np/,31675,157,373,919,192,13,0,31675,,,,,https://pbs.twimg.com/profile_banners/547853894/1674226811,https://www.twitter.com/SumanaShrestha,https://pbs.twimg.com/profile_images/616529424876306432/xIOqRt9z_normal.png,FALSE,FALSE,"4/8/2012, 1:20:11 AM","2/20/2023, 1:39:18 PM"
1.77659E+18,SumanaShrestha,Sumana,Sumana,,"सुझाव दिनुहोस् है !

विद्यालयको स्थापना, सञ्चालन तथा व्यवस्थापनका आधारभुत विषयमा एकरुपता र स्तरीयता कायम गर्न मन्त्रालयले बनाउन लागेको ‘विद्यालय स्थापना, सञ्चालन तथा व्यवस्थापनसम्बन्धी मापदण्ड, २०८०’ को मस्यौदा सबै सरोकारवालाको सुझावको लागि सार्वजनिक गरिएको छ। कमेन्टमा राखिएको… https://t.co/6uwN7HO70j",43356,19,1088,178,153,13,FALSE,FALSE,FALSE,,,FALSE,ne,Nepal,"Minister, Ministry of Education, Science and Technology | @Moest_Nepal 🇳🇵| 📧: secretariat.minister@moest.gov.np",https://sumanashrestha.com.np/,https://sumanashrestha.com.np/,31675,157,373,919,192,13,0,31675,,,,,https://pbs.twimg.com/profile_banners/547853894/1674226811,https://www.twitter.com/SumanaShrestha,https://pbs.twimg.com/profile_images/616529424876306432/xIOqRt9z_normal.png,FALSE,FALSE,"4/8/2012, 1:20:11 AM","4/6/2024, 6:05:44 PM"
1.65035E+18,SumanaShrestha,Sumana,Sumana,,"हामीले हिजो अख्तियार दुरुपयोग अनुसन्धान आयोग (तेस्रो संशोधन) विधेयक, २०७६ मा संशोधनहरु बुझाएका छौँ। 

हामीले बुझाएक संशोधन, यहाँहरुले बुझाउनु भएका सुझावहरु र सो सुझावमा हाम्रो प्रतिक्रियाहरु - सबै हाम्रो वेबसाईटमा उपलब्ध गराएका छौँ।

https://t.co/PpZc0qLveE

#Nepal #RSP #ghanti https://t.co/689UnrvFsA",61192,1,1035,30,98,13,FALSE,FALSE,FALSE,,https://sumanashrestha.com.np/parliament/bills/2023-04/akhtiyaar-3-sansodhan/#%E0%A4%9B%E0%A4%B2%E0%A4%AB%E0%A4%B2,FALSE,ne,Nepal,"Minister, Ministry of Education, Science and Technology | @Moest_Nepal 🇳🇵| 📧: secretariat.minister@moest.gov.np",https://sumanashrestha.com.np/,https://sumanashrestha.com.np/,31675,157,373,919,192,13,0,31675,,,,,https://pbs.twimg.com/profile_banners/547853894/1674226811,https://www.twitter.com/SumanaShrestha,https://pbs.twimg.com/profile_images/616529424876306432/xIOqRt9z_normal.png,FALSE,FALSE,"4/8/2012, 1:20:11 AM","4/24/2023, 10:01:40 AM"
1.64994E+18,SumanaShrestha,Sumana,Sumana,,भ्रमको खेती नगरम। भ्रममा नपरम। https://t.co/5uFPaUOVXd,41559,1,999,33,112,6,FALSE,FALSE,FALSE,,,FALSE,ne,Nepal,"Minister, Ministry of Education, Science and Technology | @Moest_Nepal 🇳🇵| 📧: secretariat.minister@moest.gov.np",https://sumanashrestha.com.np/,https://sumanashrestha.com.np/,31675,157,373,919,192,13,0,31675,,,,,https://pbs.twimg.com/profile_banners/547853894/1674226811,https://www.twitter.com/SumanaShrestha,https://pbs.twimg.com/profile_images/616529424876306432/xIOqRt9z_normal.png,FALSE,FALSE,"4/8/2012, 1:20:11 AM","4/23/2023, 6:56:55 AM"
1.61675E+18,SumanaShrestha,Sumana,Sumana,,"""हामीले सुधार र सुशासनको ठूल्ठूला बाचा गरेका छौँ। त्यसको सुरुवात यस गरिमामय सदनबाटै गरौँ। एउटा संसदीय क्यालेन्डर बनाऔँ, प्राथमिकता निर्धारण गरौँ र त्यसलाई दरिलो राजनीतिक इच्छा शक्तिका साथ कडाइपूर्वक  पालना गरेर अघि बढौँ।"" 

आजको सदनमा मेरो वक्तव्य । https://t.co/Wfq3JivsLM",90669,1,993,67,71,26,FALSE,FALSE,FALSE,,,FALSE,ne,Nepal,"Minister, Ministry of Education, Science and Technology | @Moest_Nepal 🇳🇵| 📧: secretariat.minister@moest.gov.np",https://sumanashrestha.com.np/,https://sumanashrestha.com.np/,31675,157,373,919,192,13,0,31675,,,,,https://pbs.twimg.com/profile_banners/547853894/1674226811,https://www.twitter.com/SumanaShrestha,https://pbs.twimg.com/profile_images/616529424876306432/xIOqRt9z_normal.png,FALSE,FALSE,"4/8/2012, 1:20:11 AM","1/21/2023, 4:17:52 PM"
1.6798E+18,SumanaShrestha,Sumana,Sumana,,"NOC लिन विद्यार्थीहरुलाई कति दुःख दिएर व्यवहार अपमानजनक गरेको? यो हुँदै भएन। कैयौँ विद्यालयहरुमा उपकूलपति छैनन्। 
कूलपति प्रम छन्। कार्यकारी पद सजावटी भैसक्यो। विश्वविद्यालयको राजनीतिकरण कहिले बन्द गर्ने? 

नेपालमा पढ्ने विद्यार्थीलाई पनि सास्ती, बाहिर जान्छु भन्नेलाई पनि सास्ती? https://t.co/rteYZ6SMp4",49650,1,988,99,152,27,FALSE,FALSE,FALSE,,,FALSE,ne,Nepal,"Minister, Ministry of Education, Science and Technology | @Moest_Nepal 🇳🇵| 📧: secretariat.minister@moest.gov.np",https://sumanashrestha.com.np/,https://sumanashrestha.com.np/,31675,157,373,919,192,13,0,31675,,,,,https://pbs.twimg.com/profile_banners/547853894/1674226811,https://www.twitter.com/SumanaShrestha,https://pbs.twimg.com/profile_images/616529424876306432/xIOqRt9z_normal.png,FALSE,FALSE,"4/8/2012, 1:20:11 AM","7/14/2023, 3:58:01 PM"
1.64892E+18,SumanaShrestha,Sumana,Sumana,,"'अख्तियार दुरुपयोग अनसुन्धान आयोग ऐन, २०४८ लाई संशोधन गर्न बनेको विधेयक' हिजो पेश भएको छ। भ्रष्टाचार निवारण गर्न अख्तियारलाई कसरी सशक्त बनाउन सकिन्छ? 

यहाँहरुको सल्लाह र सुझावको आवश्यकता छ। कृपया यो लिङ्कमा आफ्न संशोधन प्रस्तावहरू राखिदिनु होलाः  https://t.co/oMTwyprkU5 https://t.co/q8j4sqmJlx",56252,3,981,89,122,8,FALSE,FALSE,FALSE,,https://forms.gle/v9QvPbKQjWJeMi6S8,FALSE,ne,Nepal,"Minister, Ministry of Education, Science and Technology | @Moest_Nepal 🇳🇵| 📧: secretariat.minister@moest.gov.np",https://sumanashrestha.com.np/,https://sumanashrestha.com.np/,31675,157,373,919,192,13,0,31675,,,,,https://pbs.twimg.com/profile_banners/547853894/1674226811,https://www.twitter.com/SumanaShrestha,https://pbs.twimg.com/profile_images/616529424876306432/xIOqRt9z_normal.png,FALSE,FALSE,"4/8/2012, 1:20:11 AM","4/20/2023, 11:24:37 AM"
1.63655E+18,SumanaShrestha,Sumana,Sumana,,"दिउसोको खाजाको स्तरले शैक्षिक स्तर उकास्नमा ठूलो भूमिका खेल्छ भनेर अनुसन्धानले देखाएको छ । हरि ढकालजीले ७ घण्टा हिडेर यो स्कुल पुग्नुभएको हो सलाम छ वहाँलाई । कसैलाई यो स्टन्टबाजी लाग्छ भने यस्तो स्टन्टबाजी सबैले गरौँ, दूरदराजका यस्ता स्कुलहरू सबैमा पुगौं र विद्यार्थीको हकको लागि+",96141,7,950,57,120,28,FALSE,FALSE,FALSE,,,TRUE,ne,Nepal,"Minister, Ministry of Education, Science and Technology | @Moest_Nepal 🇳🇵| 📧: secretariat.minister@moest.gov.np",https://sumanashrestha.com.np/,https://sumanashrestha.com.np/,31675,157,373,919,192,13,0,31675,,,,,https://pbs.twimg.com/profile_banners/547853894/1674226811,https://www.twitter.com/SumanaShrestha,https://pbs.twimg.com/profile_images/616529424876306432/xIOqRt9z_normal.png,FALSE,FALSE,"4/8/2012, 1:20:11 AM","3/17/2023, 8:03:08 AM"
1.68876E+18,SumanaShrestha,Sumana,Sumana,,"संसद जनताको हो । यो आधार हो। यो बिना सरकार छैन, कर छैन, केहि छैन। धेरै लामो समयदेखि पर्दा पछाडि वार्ता गरिरहनुभएको छ। भ्रष्टाचार लुकाउन र भ्रष्टाचारीलाई जोगाउन जनतालाई भ्रममा पार्न धेरै आयोगहरू प्रयोग भएका छन्। जनताका लागि संसद खोल्नु पर्छ । https://t.co/rJ6esevqDn",35602,0,960,33,149,11,FALSE,FALSE,FALSE,,,FALSE,ne,Nepal,"Minister, Ministry of Education, Science and Technology | @Moest_Nepal 🇳🇵| 📧: secretariat.minister@moest.gov.np",https://sumanashrestha.com.np/,https://sumanashrestha.com.np/,31675,157,373,919,192,13,0,31675,,,,,https://pbs.twimg.com/profile_banners/547853894/1674226811,https://www.twitter.com/SumanaShrestha,https://pbs.twimg.com/profile_images/616529424876306432/xIOqRt9z_normal.png,FALSE,FALSE,"4/8/2012, 1:20:11 AM","8/8/2023, 9:54:30 AM"
1.65507E+18,SumanaShrestha,Sumana,Sumana,,"'शिक्षा, स्वास्थ्य तथा सूचना प्रविधि' संसदीय समितिको सदस्यताका साथै मलाई रास्वपाको दुई केन्द्रीय विभागका अध्यक्षको जिम्मेवारी पनि सुम्पिइएको छ – 'शिक्षा विभाग' र 'विज्ञान, सञ्चार तथा सूचना प्रविधि विभाग'।

यी भुमिका निर्वाह गर्न मलाई विशेषज्ञहरूको खाँचो छ। https://t.co/fDvpsjqfSD https://t.co/iyMF8I41ed",47948,2,955,44,81,7,FALSE,FALSE,FALSE,,https://forms.gle/4j3CAUkvsGa1hVp4A,FALSE,ne,Nepal,"Minister, Ministry of Education, Science and Technology | @Moest_Nepal 🇳🇵| 📧: secretariat.minister@moest.gov.np",https://sumanashrestha.com.np/,https://sumanashrestha.com.np/,31675,157,373,919,192,13,0,31675,,,,,https://pbs.twimg.com/profile_banners/547853894/1674226811,https://www.twitter.com/SumanaShrestha,https://pbs.twimg.com/profile_images/616529424876306432/xIOqRt9z_normal.png,FALSE,FALSE,"4/8/2012, 1:20:11 AM","5/7/2023, 10:16:03 AM"
1.77512E+18,SumanaShrestha,Sumana,Sumana,,*पूर्वाञ्चल विश्वविद्यालयको उपकुलपतिका लागि दरखास्त स्वीकृत भएका उम्मेदवारहरूलाई प्रस्तुतीकरणको लागि सूचना*… https://t.co/fDql4vrnZt,56333,9,944,72,77,12,FALSE,FALSE,FALSE,,,FALSE,ne,Nepal,"Minister, Ministry of Education, Science and Technology | @Moest_Nepal 🇳🇵| 📧: secretariat.minister@moest.gov.np",https://sumanashrestha.com.np/,https://sumanashrestha.com.np/,31675,157,373,919,192,13,0,31675,,,,,https://pbs.twimg.com/profile_banners/547853894/1674226811,https://www.twitter.com/SumanaShrestha,https://pbs.twimg.com/profile_images/616529424876306432/xIOqRt9z_normal.png,FALSE,FALSE,"4/8/2012, 1:20:11 AM","4/2/2024, 5:07:25 PM"
1.65067E+18,SumanaShrestha,Sumana,Sumana,,"Point of departure - in Nepali politics. @SwarnimWagle यात्रा बल्ल शुरु भयो तर अहिले नै ठूलो सन्देश दिनु भयो - पोलिटिकल पार्टीको cultural shift को लागि external catalyst । योग्य जनशक्ति जताततै छ - समयमै अवसर पाउनु पर्यो । साथै, योग्यको बदलिंदो परिभाषा पनि अनुसरण गर्नु पर्यो ।",37081,2,930,32,81,6,FALSE,FALSE,FALSE,SwarnimWagle,,FALSE,ne,Nepal,"Minister, Ministry of Education, Science and Technology | @Moest_Nepal 🇳🇵| 📧: secretariat.minister@moest.gov.np",https://sumanashrestha.com.np/,https://sumanashrestha.com.np/,31675,157,373,919,192,13,0,31675,,,,,https://pbs.twimg.com/profile_banners/547853894/1674226811,https://www.twitter.com/SumanaShrestha,https://pbs.twimg.com/profile_images/616529424876306432/xIOqRt9z_normal.png,FALSE,FALSE,"4/8/2012, 1:20:11 AM","4/25/2023, 7:05:23 AM"
1.63008E+18,SumanaShrestha,Sumana,Sumana,,सांसदको लागि भत्ता किन होला? https://t.co/Oz0ZY7tkqz,68847,0,916,62,156,23,FALSE,FALSE,FALSE,,,FALSE,ne,Nepal,"Minister, Ministry of Education, Science and Technology | @Moest_Nepal 🇳🇵| 📧: secretariat.minister@moest.gov.np",https://sumanashrestha.com.np/,https://sumanashrestha.com.np/,31675,157,373,919,192,13,0,31675,,,,,https://pbs.twimg.com/profile_banners/547853894/1674226811,https://www.twitter.com/SumanaShrestha,https://pbs.twimg.com/profile_images/616529424876306432/xIOqRt9z_normal.png,FALSE,FALSE,"4/8/2012, 1:20:11 AM","2/27/2023, 11:23:55 AM"
1.6283E+18,SumanaShrestha,Sumana,Sumana,,अहिले बाल मन्दिरको र ललितकलाको स्वामित्वमा रहेको जम्मा जम्मी ५७ रोपनी जग्गा कसले भोग चलन गरिरहेको छ ? कसको हितमा प्रयोग हुदैछ? अनाथ बालबालिकको लागि कि कौडीको भाउमा बाहालमा लिएर व्यवसाय चलाउने नाम कहिलिएका व्यक्तित्व र व्यवसायिक घरानाहरूको हितमा? आजको सदनमा ध्यानाकर्षणको पूर्णपाठ: https://t.co/NVCFXxtBPZ,107167,3,913,51,156,17,FALSE,FALSE,FALSE,,,FALSE,ne,Nepal,"Minister, Ministry of Education, Science and Technology | @Moest_Nepal 🇳🇵| 📧: secretariat.minister@moest.gov.np",https://sumanashrestha.com.np/,https://sumanashrestha.com.np/,31675,157,373,919,192,13,0,31675,,,,,https://pbs.twimg.com/profile_banners/547853894/1674226811,https://www.twitter.com/SumanaShrestha,https://pbs.twimg.com/profile_images/616529424876306432/xIOqRt9z_normal.png,FALSE,FALSE,"4/8/2012, 1:20:11 AM","2/22/2023, 1:48:53 PM"
1.66317E+18,SumanaShrestha,Sumana,Sumana,,गलत गलत गलत निर्णय। सांसदको काम के हो अर्थमन्त्री ज्यु? किन भौतिक प्रोजेक्टको मैनेजर बनाउन खोज्नू भएको? किन स्थानीय सरकारको कार्य गर भन्ने। किन चुनाव लक्षित बजेट? नीतिगत भ्रष्टाचार लाग्छ।  https://t.co/98Bi8tCzUV,62013,5,907,64,168,20,FALSE,FALSE,FALSE,,https://www.ukaalo.com/news/20230529-budget-to-parliametaries/7191,FALSE,ne,Nepal,"Minister, Ministry of Education, Science and Technology | @Moest_Nepal 🇳🇵| 📧: secretariat.minister@moest.gov.np",https://sumanashrestha.com.np/,https://sumanashrestha.com.np/,31675,157,373,919,192,13,0,31675,,,,,https://pbs.twimg.com/profile_banners/547853894/1674226811,https://www.twitter.com/SumanaShrestha,https://pbs.twimg.com/profile_images/616529424876306432/xIOqRt9z_normal.png,FALSE,FALSE,"4/8/2012, 1:20:11 AM","5/29/2023, 6:56:13 PM"
1.66015E+18,SumanaShrestha,Sumana,Sumana,,"आगामी वर्षको नीति तथा कार्यक्रमको अध्ययनको लागि जम्मा बीस घण्टाको समय दिएता पनि, जति सक्दो अध्ययन गरेर मैले हिजो समय सीमा मा अडिएर ठिक १ः५५मा संशोधनहरु हातैले लेखेर बुझाएँ। मैले राखेका २०-बुँदे संशोधन र त्यसका कारणहरु यी भिडियो मार्फत यहाँलाई अवगत गराउन चाहेँ। 

#Nepal #budget https://t.co/1HwpcB9Sg5",47386,5,886,24,91,8,FALSE,FALSE,FALSE,,,FALSE,ne,Nepal,"Minister, Ministry of Education, Science and Technology | @Moest_Nepal 🇳🇵| 📧: secretariat.minister@moest.gov.np",https://sumanashrestha.com.np/,https://sumanashrestha.com.np/,31675,157,373,919,192,13,0,31675,,,,,https://pbs.twimg.com/profile_banners/547853894/1674226811,https://www.twitter.com/SumanaShrestha,https://pbs.twimg.com/profile_images/616529424876306432/xIOqRt9z_normal.png,FALSE,FALSE,"4/8/2012, 1:20:11 AM","5/21/2023, 10:53:01 AM"
1.66056E+18,SumanaShrestha,Sumana,Sumana,,"सांसद भएपछि मैले मेरो टिमलाई म जहिले मेरो हाजिरीको फोटो पठाउँछु भनेकी थिएँ। बायोमेट्रिक नभएको खण्डमा मेरो टिमले मलाई जवाफदेही बनाउने अवस्था थिएन।आजबाट संघिय संसद सचिवालयले बायोमेट्रिक हाजिरी लागू गरेको छ।सानो जीत।

अब भने रियल-टाइममा सांसदको सदनमा हाजिरीको तथ्याङ्क माग गर्नुपर्छ। https://t.co/XEIQ9sU9mV",41335,0,880,40,72,10,FALSE,FALSE,FALSE,,,FALSE,ne,Nepal,"Minister, Ministry of Education, Science and Technology | @Moest_Nepal 🇳🇵| 📧: secretariat.minister@moest.gov.np",https://sumanashrestha.com.np/,https://sumanashrestha.com.np/,31675,157,373,919,192,13,0,31675,,,,,https://pbs.twimg.com/profile_banners/547853894/1674226811,https://www.twitter.com/SumanaShrestha,https://pbs.twimg.com/profile_images/616529424876306432/xIOqRt9z_normal.png,FALSE,FALSE,"4/8/2012, 1:20:11 AM","5/22/2023, 1:45:08 PM"
1.72553E+18,SumanaShrestha,Sumana,Sumana,,"आफुले जनताका लागी कोशिश गरेका काम को रिपोर्ट सहित भोलिबाट काठमाडौ-०४, तपाईको घरदैलोमा आउदैछौ । धन्यवाद सहित तपाईका कुरा सुन्न । https://t.co/ypt9I41Fcc",127578,0,873,65,48,27,FALSE,FALSE,FALSE,,,FALSE,ne,Nepal,"Minister, Ministry of Education, Science and Technology | @Moest_Nepal 🇳🇵| 📧: secretariat.minister@moest.gov.np",https://sumanashrestha.com.np/,https://sumanashrestha.com.np/,31675,157,373,919,192,13,0,31675,,,,,https://pbs.twimg.com/profile_banners/547853894/1674226811,https://www.twitter.com/SumanaShrestha,https://pbs.twimg.com/profile_images/616529424876306432/xIOqRt9z_normal.png,FALSE,FALSE,"4/8/2012, 1:20:11 AM","11/17/2023, 8:48:22 PM"
1.68079E+18,SumanaShrestha,Sumana,Sumana,,"अपराधलाई पखाल्ने गंगाजलको रुपमा राजनीतिलाई अपराधीकरण गर्ने, शक्ति पृथकिकरणको विरुद्ध ल्याइएको यो विधेयक हिजो संसदमा पेश भएको छ। के यसैका लागि जनताले हामीलाई मत दिएर पठाएको हो? म जनतालाई सोध्न चाहन्छु, के गुण्डागर्दीको संरक्षणका लागि पठाउनु भएको हो? सोध्नुस् आफ्ना जनप्रतिनिधिलाई!",61635,2,853,50,141,15,FALSE,FALSE,FALSE,,,TRUE,ne,Nepal,"Minister, Ministry of Education, Science and Technology | @Moest_Nepal 🇳🇵| 📧: secretariat.minister@moest.gov.np",https://sumanashrestha.com.np/,https://sumanashrestha.com.np/,31675,157,373,919,192,13,0,31675,,,,,https://pbs.twimg.com/profile_banners/547853894/1674226811,https://www.twitter.com/SumanaShrestha,https://pbs.twimg.com/profile_images/616529424876306432/xIOqRt9z_normal.png,FALSE,FALSE,"4/8/2012, 1:20:11 AM","7/17/2023, 9:33:06 AM"
